----------------------Log:---------------------------------
[ADD] Process 0 added to the queue at time 1.707401990890503, shots: 1000.
[ADD] Process 1 added to the queue at time 3.96323561668396, shots: 1000.
[ADD] Process 2 added to the queue at time 4.388476371765137, shots: 1000.
[ADD] Process 3 added to the queue at time 4.572816848754883, shots: 1000.
[ADD] Process 4 added to the queue at time 8.285865306854248, shots: 1000.
[ADD] Process 5 added to the queue at time 9.775825262069702, shots: 1000.
[ADD] Process 6 added to the queue at time 9.827322006225586, shots: 1000.
[ADD] Process 7 added to the queue at time 10.271392107009888, shots: 1000.
[ADD] Process 8 added to the queue at time 10.317690134048462, shots: 1000.
[ADD] Process 9 added to the queue at time 12.417082786560059, shots: 1000.
[ADD] Process 10 added to the queue at time 13.733327388763428, shots: 1000.
[ADD] Process 11 added to the queue at time 14.729174613952637, shots: 1000.
[ADD] Process 12 added to the queue at time 17.492945909500122, shots: 1000.
[ADD] Process 13 added to the queue at time 19.8641939163208, shots: 1000.
[ADD] Process 14 added to the queue at time 21.863665342330933, shots: 1000.
[ADD] Process 15 added to the queue at time 22.406776905059814, shots: 1000.
[ADD] Process 16 added to the queue at time 27.660524606704712, shots: 1000.
[ADD] Process 17 added to the queue at time 27.851381301879883, shots: 1000.
[BATCH] Process batch with [0, 1, 2, 3, 4, 5, 6, 7, 8, 9, 10, 11, 12, 13, 14, 15, 16, 17] selected with min shots 1000.
[ADD] Process 18 added to the queue at time 28.02585005760193, shots: 1000.
[ADD] Process 19 added to the queue at time 29.574222803115845, shots: 1000.
[ADD] Process 20 added to the queue at time 29.962615728378296, shots: 1000.
[ADD] Process 21 added to the queue at time 30.302675008773804, shots: 1000.
[ADD] Process 22 added to the queue at time 33.19517660140991, shots: 1000.
[ADD] Process 23 added to the queue at time 35.983256816864014, shots: 1000.
[ADD] Process 24 added to the queue at time 39.207130908966064, shots: 1000.
[ADD] Process 25 added to the queue at time 41.994842767715454, shots: 1000.
[UTILITY] New batch has utility 0.9473684210526315.
[PROCESS COUNT] New batch has 18 processes.
[SHARING RATIO] New batch has helper qubit sharing ratio 0.28888888888888886.
[HARDWARE RESULT] {0: {'00': 747, '11': 26, '01': 144, '10': 83}, 5: {'11': 11, '10': 549, '00': 425, '01': 15}, 12: {'00': 276, '10': 330, '01': 211, '11': 183}, 4: {'00': 463, '01': 140, '10': 287, '11': 110}, 13: {'000': 807, '110': 12, '100': 59, '001': 49, '010': 53, '011': 13, '111': 5, '101': 2}, 1: {'110': 434, '000': 82, '101': 19, '010': 197, '100': 168, '111': 68, '011': 27, '001': 5}, 6: {'000': 276, '010': 132, '100': 177, '001': 186, '110': 74, '111': 17, '011': 35, '101': 103}, 8: {'000': 220, '001': 211, '100': 119, '101': 161, '010': 83, '111': 56, '110': 66, '011': 84}, 10: {'101': 59, '010': 233, '001': 150, '000': 136, '100': 65, '011': 194, '111': 76, '110': 87}, 15: {'100': 254, '001': 180, '101': 176, '000': 205, '111': 46, '011': 37, '110': 52, '010': 50}, 11: {'0100': 441, '0000': 356, '0101': 50, '0011': 7, '0010': 27, '0001': 29, '0110': 24, '1110': 2, '0111': 6, '1100': 22, '1000': 30, '1010': 3, '1001': 2, '1111': 1}, 14: {'1010': 153, '1100': 47, '1000': 103, '0011': 55, '0110': 63, '1001': 34, '0010': 152, '0000': 123, '1110': 57, '0111': 23, '0001': 54, '1111': 21, '0100': 53, '1011': 39, '0101': 15, '1101': 8}, 16: {'1110': 78, '0110': 65, '1001': 53, '1010': 80, '0100': 67, '0001': 54, '0010': 59, '0011': 52, '1011': 59, '0101': 58, '1100': 70, '1101': 70, '0000': 66, '1111': 58, '1000': 66, '0111': 45}, 17: {'00000': 362, '10000': 357, '11000': 55, '00001': 26, '10001': 18, '01010': 9, '00100': 4, '11010': 5, '10010': 38, '01000': 60, '00010': 44, '01001': 10, '11001': 2, '10100': 4, '10011': 3, '00011': 3}, 7: {'110110': 18, '000010': 23, '011111': 18, '001011': 12, '000000': 31, '100001': 16, '000101': 21, '011010': 12, '000110': 36, '010110': 20, '101010': 8, '110000': 18, '010000': 14, '101000': 10, '100010': 17, '001100': 14, '100101': 15, '101100': 10, '100011': 20, '000100': 36, '001101': 19, '101111': 9, '111110': 12, '101110': 8, '010011': 17, '111101': 7, '000111': 28, '111000': 8, '100111': 29, '111010': 5, '000011': 27, '110111': 22, '010111': 26, '110001': 12, '110101': 13, '001110': 16, '100110': 18, '011000': 12, '010101': 21, '100000': 9, '001000': 18, '111001': 8, '011001': 10, '010100': 16, '100100': 11, '010001': 18, '000001': 22, '110010': 16, '110011': 12, '011101': 15, '111011': 8, '110100': 16, '011100': 15, '001010': 16, '001001': 11, '101001': 10, '111100': 9, '101011': 10, '010010': 16, '111111': 10, '001111': 20, '011011': 11, '011110': 4, '101101': 11}, 2: {'0001100': 33, '0001011': 12, '1000110': 11, '1001111': 15, '1110000': 3, '0000101': 3, '1001011': 8, '0111001': 4, '0101000': 21, '1100110': 3, '0001110': 32, '0000100': 8, '0100101': 3, '0001111': 13, '1100100': 4, '0101101': 5, '1001010': 22, '1111000': 5, '1101100': 17, '1011000': 17, '0011001': 8, '0011000': 21, '0000011': 6, '1101110': 14, '0101100': 26, '0100000': 11, '1010111': 2, '0001101': 21, '1001110': 26, '1001000': 28, '1111101': 3, '0001010': 25, '0001001': 19, '0001000': 45, '0010000': 16, '1001001': 12, '0110000': 3, '1011010': 5, '1001101': 9, '1011011': 4, '0111101': 3, '0000111': 3, '0111110': 9, '0100010': 12, '1001100': 38, '1011100': 9, '1011111': 5, '0101110': 12, '1111010': 2, '1000001': 5, '1111110': 5, '0011010': 10, '1000000': 8, '1100001': 2, '0111100': 5, '0101011': 2, '1000100': 9, '0011100': 27, '0011011': 3, '1101000': 13, '0101010': 16, '0110010': 1, '1000101': 4, '1111100': 4, '0111000': 6, '1000010': 10, '1101001': 6, '0011110': 13, '1100000': 9, '0100100': 5, '0100110': 7, '0101111': 5, '1101101': 10, '1101010': 16, '1010001': 5, '0010100': 2, '1010110': 5, '0000110': 8, '0011101': 5, '0000010': 9, '0101001': 10, '0011111': 4, '0010110': 7, '0110100': 4, '1111111': 2, '0000000': 10, '1110001': 1, '0010010': 6, '0010001': 1, '1000111': 4, '1101011': 4, '1101111': 8, '1011110': 9, '0100111': 3, '0110110': 2, '0000001': 1, '0010111': 1, '1010100': 2, '0111010': 2, '1111001': 3, '0110011': 1, '0010011': 3, '1011101': 6, '1100101': 3, '1100010': 1, '1010000': 4, '0111011': 1, '0100001': 4, '0100011': 2, '1010011': 1, '1010101': 1, '1010010': 2, '0010101': 3, '1110101': 1, '1111011': 2, '1100011': 1, '1110110': 2, '0110101': 1, '1100111': 2, '1011001': 2, '1110100': 1, '0111111': 1}, 3: {'1100101': 15, '1011110': 5, '0101111': 18, '0000111': 41, '1001100': 5, '0101110': 17, '1101101': 6, '0110110': 9, '1000100': 16, '1111000': 3, '0101101': 8, '0110101': 1, '1110110': 7, '0100110': 39, '0100111': 39, '0000101': 22, '1001110': 12, '1010110': 5, '1010010': 3, '1100110': 28, '0100100': 9, '0000100': 19, '0001110': 13, '0100101': 17, '0111110': 4, '1100001': 10, '0110111': 6, '0100001': 9, '1001010': 3, '0000010': 17, '1010101': 3, '1010111': 8, '0100010': 19, '0101010': 9, '0000110': 35, '1101111': 14, '1000101': 21, '0011111': 1, '1001001': 4, '1001111': 18, '1110011': 8, '1110010': 6, '1101100': 10, '1010100': 5, '0100011': 13, '1001101': 8, '0101100': 8, '1000010': 8, '0001001': 5, '1100111': 23, '1101000': 3, '1000110': 36, '1000111': 32, '1100011': 9, '0110010': 1, '1000011': 11, '0001010': 9, '0010110': 6, '0010111': 11, '0111011': 1, '1100010': 13, '1100100': 9, '1100000': 6, '0000011': 14, '1101001': 3, '0101001': 3, '0010101': 7, '1111001': 2, '0100000': 7, '0001100': 9, '0110100': 4, '0111111': 3, '1111111': 3, '0000001': 9, '0010010': 5, '0001111': 17, '1101110': 14, '0010001': 3, '0001101': 7, '1101010': 9, '1001011': 7, '1011101': 2, '1110101': 4, '0000000': 7, '0001011': 8, '0101011': 7, '1000000': 6, '0111100': 1, '0001000': 3, '0101000': 2, '0010100': 2, '0110011': 2, '0011100': 1, '1111101': 2, '1110111': 3, '1011111': 3, '0010011': 3, '1010011': 3, '1111110': 2, '1001000': 1, '1011011': 2, '1000001': 5, '0111101': 1, '1101011': 3, '1110001': 1, '0011110': 2, '0110001': 2, '0110000': 1, '1010001': 2, '0111010': 2, '1110000': 1, '1111010': 2, '0011011': 2, '1111100': 1, '1011100': 2, '0011101': 2, '0010000': 2}, 9: {'0000100': 6, '0100000': 20, '0010001': 11, '0000000': 24, '1001001': 8, '0010010': 25, '0000111': 8, '1011001': 7, '0000011': 19, '0011001': 7, '0111011': 4, '1010111': 6, '1000010': 30, '0010110': 16, '1011100': 8, '1000101': 10, '0100010': 13, '1111000': 6, '0011000': 11, '0010000': 16, '1001011': 7, '1001101': 4, '1100011': 9, '0000001': 16, '1101000': 3, '1100000': 18, '0011100': 7, '0010101': 7, '1010010': 21, '1101100': 2, '0111101': 3, '0011010': 8, '1010110': 6, '0100100': 7, '1010001': 13, '1010011': 15, '0001000': 13, '0111100': 2, '1110110': 4, '1000011': 22, '1111001': 7, '1110111': 5, '1011000': 9, '1110011': 8, '1001100': 6, '0001100': 5, '0001010': 9, '1110000': 12, '0100111': 5, '0101011': 4, '0000010': 16, '1110001': 8, '1010000': 26, '0110001': 9, '0110000': 10, '1101010': 12, '0010100': 8, '0111001': 1, '1000000': 34, '1001010': 11, '0001001': 3, '1000100': 12, '1011110': 7, '1011010': 5, '1010100': 13, '0000110': 9, '1101011': 6, '1100010': 12, '1011011': 6, '0101001': 4, '1110010': 12, '1100110': 4, '0101010': 3, '1001110': 7, '1000111': 8, '1001111': 3, '0110100': 2, '1011101': 4, '0110111': 3, '1000001': 31, '1111111': 3, '0111010': 5, '1100111': 5, '1010101': 7, '0110011': 8, '0110110': 3, '1111011': 4, '0100001': 8, '0010011': 13, '1000110': 9, '1101001': 4, '1001000': 13, '0010111': 7, '0011101': 3, '1110101': 7, '1100001': 13, '0100101': 6, '0000101': 6, '0110010': 10, '1111101': 3, '0100011': 9, '0100110': 4, '0110101': 3, '0101110': 2, '1100100': 2, '0101101': 2, '0111110': 1, '0111000': 4, '1100101': 2, '0101111': 3, '1101110': 1, '0001011': 5, '1111010': 2, '1101111': 3, '0001111': 3, '0101100': 2, '0001110': 2, '1111100': 1, '1110100': 2, '1111110': 2, '0011011': 3, '0001101': 1, '1011111': 1, '0011111': 1, '0101000': 1}}
[PROCESS FINISH] Process 0 finished all shots at time 194.16932940483093.
[PROCESS FIDELITY] Process 0 fidelity: 0.747
[PROCESS WAITING TIME] Process 0 waiting time: 192.46192741394043 seconds
[PROCESS FINISH] Process 1 finished all shots at time 194.1717438697815.
[PROCESS FIDELITY] Process 1 fidelity: 0.06800000000000006
[PROCESS WAITING TIME] Process 1 waiting time: 190.20850825309753 seconds
[PROCESS FINISH] Process 2 finished all shots at time 194.17820620536804.
[PROCESS FIDELITY] Process 2 fidelity: 0.0020000000000024443
[PROCESS WAITING TIME] Process 2 waiting time: 189.7897298336029 seconds
[PROCESS FINISH] Process 3 finished all shots at time 194.18619537353516.
[PROCESS FIDELITY] Process 3 fidelity: 0.0030000000000028892
[PROCESS WAITING TIME] Process 3 waiting time: 189.61337852478027 seconds
[PROCESS FINISH] Process 4 finished all shots at time 194.18619537353516.
[PROCESS FIDELITY] Process 4 fidelity: 0.10999999999999999
[PROCESS WAITING TIME] Process 4 waiting time: 185.9003300666809 seconds
[PROCESS FINISH] Process 5 finished all shots at time 194.1892273426056.
[PROCESS FIDELITY] Process 5 fidelity: 0.42500000000000004
[PROCESS WAITING TIME] Process 5 waiting time: 184.4134020805359 seconds
[PROCESS FINISH] Process 6 finished all shots at time 194.1892273426056.
[PROCESS FIDELITY] Process 6 fidelity: 0.017000000000000015
[PROCESS WAITING TIME] Process 6 waiting time: 184.36190533638 seconds
[PROCESS FINISH] Process 7 finished all shots at time 194.19023776054382.
[PROCESS FIDELITY] Process 7 fidelity: 0.009999999999999787
[PROCESS WAITING TIME] Process 7 waiting time: 183.91884565353394 seconds
[PROCESS FINISH] Process 8 finished all shots at time 194.19704723358154.
[PROCESS FIDELITY] Process 8 fidelity: 0.05599999999999994
[PROCESS WAITING TIME] Process 8 waiting time: 183.87935709953308 seconds
[PROCESS FINISH] Process 9 finished all shots at time 194.1982283592224.
[PROCESS FIDELITY] Process 9 fidelity: 0.003000000000002445
[PROCESS WAITING TIME] Process 9 waiting time: 181.78114557266235 seconds
[PROCESS FINISH] Process 10 finished all shots at time 194.1982283592224.
[PROCESS FIDELITY] Process 10 fidelity: 0.07600000000000007
[PROCESS WAITING TIME] Process 10 waiting time: 180.46490097045898 seconds
[PROCESS FINISH] Process 11 finished all shots at time 194.1992347240448.
[PROCESS FIDELITY] Process 11 fidelity: 0.356
[PROCESS WAITING TIME] Process 11 waiting time: 179.47006011009216 seconds
[PROCESS FINISH] Process 12 finished all shots at time 194.206529378891.
[PROCESS FIDELITY] Process 12 fidelity: 0.2759999999999999
[PROCESS WAITING TIME] Process 12 waiting time: 176.71358346939087 seconds
[PROCESS FINISH] Process 13 finished all shots at time 194.20757818222046.
[PROCESS FIDELITY] Process 13 fidelity: 0.807
[PROCESS WAITING TIME] Process 13 waiting time: 174.34338426589966 seconds
[PROCESS FINISH] Process 14 finished all shots at time 194.21505641937256.
[PROCESS FIDELITY] Process 14 fidelity: 0.020999999999999908
[PROCESS WAITING TIME] Process 14 waiting time: 172.35139107704163 seconds
[PROCESS FINISH] Process 15 finished all shots at time 194.21606063842773.
[PROCESS FIDELITY] Process 15 fidelity: 0.04600000000000004
[PROCESS WAITING TIME] Process 15 waiting time: 171.80928373336792 seconds
[PROCESS FINISH] Process 16 finished all shots at time 194.21606063842773.
[PROCESS FIDELITY] Process 16 fidelity: 0.05799999999999994
[PROCESS WAITING TIME] Process 16 waiting time: 166.55553603172302 seconds
[PROCESS FINISH] Process 17 finished all shots at time 194.21606063842773.
[PROCESS FIDELITY] Process 17 fidelity: 0.362
[PROCESS WAITING TIME] Process 17 waiting time: 166.36467933654785 seconds
[BATCH] Process batch with [18, 19, 20, 21, 22, 23, 24, 25] selected with min shots 1000.
[UTILITY] New batch has utility 0.5112781954887218.
[PROCESS COUNT] New batch has 8 processes.
[SHARING RATIO] New batch has helper qubit sharing ratio 0.0.
[HARDWARE RESULT] {19: {'10': 490, '00': 126, '01': 75, '11': 309}, 20: {'0100': 166, '1000': 173, '0000': 310, '0010': 45, '1100': 146, '1110': 36, '0110': 47, '1101': 5, '1010': 32, '1011': 3, '1001': 10, '0101': 4, '0111': 5, '0001': 9, '1111': 2, '0011': 7}, 18: {'1000': 81, '1010': 79, '1101': 73, '0001': 53, '0010': 57, '1110': 74, '0100': 50, '1100': 89, '1001': 79, '0000': 44, '0101': 43, '1111': 84, '0111': 41, '1011': 65, '0110': 48, '0011': 40}, 21: {'1010': 74, '1110': 76, '1011': 286, '1111': 218, '0111': 62, '0011': 66, '1101': 45, '1001': 49, '0000': 9, '0001': 10, '1100': 14, '0010': 37, '1000': 15, '0101': 7, '0110': 27, '0100': 5}, 23: {'0110': 31, '1010': 63, '1101': 134, '1100': 128, '1110': 106, '0011': 19, '1011': 54, '1111': 93, '0111': 43, '1001': 79, '0001': 36, '0000': 26, '0010': 25, '0101': 46, '1000': 66, '0100': 51}, 24: {'0100': 88, '1111': 37, '0010': 81, '0111': 64, '1100': 79, '0000': 72, '0101': 52, '0110': 112, '1000': 51, '1110': 94, '1010': 64, '1011': 43, '0001': 44, '1101': 47, '0011': 40, '1001': 32}, 22: {'010000': 213, '000001': 21, '000000': 486, '010100': 31, '010001': 9, '000010': 31, '100000': 41, '000100': 59, '100100': 9, '000110': 6, '000101': 1, '110010': 2, '110100': 4, '110000': 23, '110110': 1, '001000': 19, '000011': 3, '011100': 2, '001110': 1, '010111': 3, '111000': 2, '011000': 5, '101000': 4, '010110': 3, '100010': 5, '101100': 1, '001100': 3, '110001': 1, '010010': 7, '011010': 1, '010011': 1, '001001': 1, '001010': 1}, 25: {'001100': 13, '000000': 553, '001000': 36, '000100': 119, '000001': 88, '010100': 8, '010000': 16, '000110': 5, '100000': 50, '100100': 14, '100001': 7, '000011': 10, '101001': 3, '000101': 21, '001001': 8, '000010': 24, '010001': 5, '001101': 3, '010101': 2, '100110': 1, '011000': 4, '011100': 1, '101000': 3, '001110': 1, '111000': 1, '100010': 3, '101100': 1}}
[PROCESS FINISH] Process 18 finished all shots at time 348.6138644218445.
[PROCESS FIDELITY] Process 18 fidelity: 0.08399999999999996
[PROCESS WAITING TIME] Process 18 waiting time: 320.58801436424255 seconds
[PROCESS FINISH] Process 19 finished all shots at time 348.61445140838623.
[PROCESS FIDELITY] Process 19 fidelity: 0.30899999999999994
[PROCESS WAITING TIME] Process 19 waiting time: 319.0402286052704 seconds
[PROCESS FINISH] Process 20 finished all shots at time 348.6150772571564.
[PROCESS FIDELITY] Process 20 fidelity: 0.3100000000000003
[PROCESS WAITING TIME] Process 20 waiting time: 318.6524615287781 seconds
[PROCESS FINISH] Process 21 finished all shots at time 348.6150772571564.
[PROCESS FIDELITY] Process 21 fidelity: 0.21799999999999997
[PROCESS WAITING TIME] Process 21 waiting time: 318.31240224838257 seconds
[PROCESS FINISH] Process 22 finished all shots at time 348.6150772571564.
[PROCESS FIDELITY] Process 22 fidelity: 0.4860000000000001
[PROCESS WAITING TIME] Process 22 waiting time: 315.41990065574646 seconds
[PROCESS FINISH] Process 23 finished all shots at time 348.62409687042236.
[PROCESS FIDELITY] Process 23 fidelity: 0.09299999999999986
[PROCESS WAITING TIME] Process 23 waiting time: 312.64084005355835 seconds
[PROCESS FINISH] Process 24 finished all shots at time 348.62508511543274.
[PROCESS FIDELITY] Process 24 fidelity: 0.03700000000000003
[PROCESS WAITING TIME] Process 24 waiting time: 309.4179542064667 seconds
[PROCESS FINISH] Process 25 finished all shots at time 348.62508511543274.
[PROCESS FIDELITY] Process 25 fidelity: 0.5529999999999999
[PROCESS WAITING TIME] Process 25 waiting time: 306.6302423477173 seconds
[STOP] Scheduling stopped at time 349.63147163391113.
------------------Statistics:---------------------------------Total running time: 348.87350821495056
Finished process count: 26
Throughput: 
0.07452557843394829
----------------------Batch statistics-----------------------:
Batch 0: Number of processes: 18, Qubit utilization: 0.9473684210526315
Batch 1: Number of processes: 8, Qubit utilization: 0.5112781954887218
Batch 0: Shared ratio: 0.28888888888888886
Batch 1: Shared ratio: 0.0
Average shared ratio per batch: 0.14444444444444443
Average number of processes per batch: 13.0
Average qubit utility per batch: 0.7293233082706767
----------------------Process waiting times-----------------------:
Process 0: 192.46192741394043
Process 1: 190.20850825309753
Process 2: 189.7897298336029
Process 3: 189.61337852478027
Process 4: 185.9003300666809
Process 5: 184.4134020805359
Process 6: 184.36190533638
Process 7: 183.91884565353394
Process 8: 183.87935709953308
Process 9: 181.78114557266235
Process 10: 180.46490097045898
Process 11: 179.47006011009216
Process 12: 176.71358346939087
Process 13: 174.34338426589966
Process 14: 172.35139107704163
Process 15: 171.80928373336792
Process 16: 166.55553603172302
Process 17: 166.36467933654785
Process 18: 320.58801436424255
Process 19: 319.0402286052704
Process 20: 318.6524615287781
Process 21: 318.31240224838257
Process 22: 315.41990065574646
Process 23: 312.64084005355835
Process 24: 309.4179542064667
Process 25: 306.6302423477173
Average waiting time across all processes: 222.11936126305505
----------------------Process fidelities-----------------------:
Process 0: 0.747
Process 1: 0.06800000000000006
Process 2: 0.0020000000000024443
Process 3: 0.0030000000000028892
Process 4: 0.10999999999999999
Process 5: 0.42500000000000004
Process 6: 0.017000000000000015
Process 7: 0.009999999999999787
Process 8: 0.05599999999999994
Process 9: 0.003000000000002445
Process 10: 0.07600000000000007
Process 11: 0.356
Process 12: 0.2759999999999999
Process 13: 0.807
Process 14: 0.020999999999999908
Process 15: 0.04600000000000004
Process 16: 0.05799999999999994
Process 17: 0.362
Process 18: 0.08399999999999996
Process 19: 0.30899999999999994
Process 20: 0.3100000000000003
Process 21: 0.21799999999999997
Process 22: 0.4860000000000001
Process 23: 0.09299999999999986
Process 24: 0.03700000000000003
Process 25: 0.5529999999999999
Average fidelity across all processes: 0.21280769230769256
