----------------------Log:---------------------------------
[ADD] Process 0 added to the queue at time 1.702784538269043, shots: 1000.
[ADD] Process 1 added to the queue at time 3.960118532180786, shots: 1000.
[ADD] Process 2 added to the queue at time 4.386461496353149, shots: 1000.
[ADD] Process 3 added to the queue at time 4.570884704589844, shots: 1000.
[ADD] Process 4 added to the queue at time 8.286237001419067, shots: 1000.
[ADD] Process 5 added to the queue at time 9.774410247802734, shots: 1000.
[ADD] Process 6 added to the queue at time 9.825716257095337, shots: 1000.
[ADD] Process 7 added to the queue at time 10.27450942993164, shots: 1000.
[ADD] Process 8 added to the queue at time 10.32137942314148, shots: 1000.
[ADD] Process 9 added to the queue at time 12.42624568939209, shots: 1000.
[ADD] Process 10 added to the queue at time 13.740766763687134, shots: 1000.
[ADD] Process 11 added to the queue at time 14.73758602142334, shots: 1000.
[ADD] Process 12 added to the queue at time 17.501455307006836, shots: 1000.
[ADD] Process 13 added to the queue at time 19.874476194381714, shots: 1000.
[ADD] Process 14 added to the queue at time 21.875245332717896, shots: 1000.
[ADD] Process 15 added to the queue at time 22.421756744384766, shots: 1000.
[ADD] Process 16 added to the queue at time 27.677472591400146, shots: 1000.
[ADD] Process 17 added to the queue at time 27.860103130340576, shots: 1000.
[BATCH] Process batch with [0, 1, 2, 3, 4, 5, 6, 7, 8, 9, 10, 11, 12, 13, 14, 15, 16, 17] selected with min shots 1000.
[ADD] Process 18 added to the queue at time 28.03584861755371, shots: 1000.
[ADD] Process 19 added to the queue at time 29.59057331085205, shots: 1000.
[ADD] Process 20 added to the queue at time 31.094749689102173, shots: 1000.
[ADD] Process 21 added to the queue at time 32.87375545501709, shots: 1000.
[ADD] Process 22 added to the queue at time 34.11964726448059, shots: 1000.
[ADD] Process 23 added to the queue at time 34.7507758140564, shots: 1000.
[ADD] Process 24 added to the queue at time 35.94906568527222, shots: 1000.
[ADD] Process 25 added to the queue at time 36.213369607925415, shots: 1000.
[ADD] Process 26 added to the queue at time 37.279369592666626, shots: 1000.
[ADD] Process 27 added to the queue at time 40.279300689697266, shots: 1000.
[UTILITY] New batch has utility 0.9398496240601504.
[PROCESS COUNT] New batch has 18 processes.
[SHARING RATIO] New batch has helper qubit sharing ratio 0.28888888888888886.
[HARDWARE RESULT] {0: {'10': 309, '00': 279, '01': 232, '11': 180}, 5: {'00': 299, '10': 364, '01': 153, '11': 184}, 12: {'00': 284, '10': 272, '11': 202, '01': 242}, 4: {'00': 375, '11': 130, '01': 157, '10': 338}, 13: {'011': 57, '100': 212, '001': 123, '000': 181, '101': 137, '110': 111, '010': 110, '111': 69}, 1: {'000': 186, '110': 105, '010': 78, '100': 181, '101': 134, '011': 76, '111': 90, '001': 150}, 6: {'101': 66, '100': 76, '000': 215, '011': 141, '010': 192, '001': 166, '110': 74, '111': 70}, 8: {'010': 189, '001': 140, '000': 182, '011': 143, '111': 73, '101': 86, '100': 99, '110': 88}, 10: {'011': 81, '101': 82, '000': 160, '111': 92, '010': 183, '110': 149, '100': 155, '001': 98}, 15: {'000': 204, '101': 137, '001': 209, '010': 124, '011': 111, '100': 110, '111': 57, '110': 48}, 11: {'1000': 177, '0000': 303, '0001': 156, '1100': 87, '0100': 107, '0010': 8, '1010': 3, '0101': 46, '1001': 77, '1101': 28, '1111': 1, '1011': 3, '1110': 1, '0110': 3}, 14: {'1010': 46, '0000': 115, '0101': 62, '1101': 62, '0100': 103, '1011': 22, '1000': 114, '1100': 107, '1001': 66, '0111': 21, '0001': 93, '0010': 46, '0011': 22, '1110': 49, '0110': 44, '1111': 28}, 16: {'1001': 71, '1000': 82, '0011': 63, '0101': 56, '0100': 65, '1010': 62, '0010': 83, '0110': 53, '0001': 77, '1100': 62, '0000': 72, '1111': 54, '0111': 45, '1110': 51, '1011': 60, '1101': 44}, 17: {'11110': 37, '01010': 43, '01100': 54, '00100': 50, '00010': 48, '11011': 21, '00101': 34, '00111': 32, '11111': 27, '11100': 35, '11000': 27, '01110': 37, '01011': 33, '00000': 48, '11101': 15, '10111': 20, '00110': 24, '01111': 22, '10000': 42, '10100': 27, '11010': 30, '01000': 57, '10101': 14, '01001': 39, '00011': 20, '00001': 36, '10110': 27, '01101': 25, '10001': 22, '10011': 16, '11001': 17, '10010': 21}, 7: {'101110': 10, '010100': 30, '010010': 13, '101100': 35, '111100': 28, '001000': 71, '011000': 25, '110100': 25, '001100': 57, '000010': 15, '110000': 26, '111101': 6, '100000': 41, '100110': 9, '111000': 16, '100111': 5, '100001': 10, '101111': 8, '000000': 54, '011010': 10, '010001': 12, '000001': 19, '001010': 18, '010110': 7, '101011': 4, '000110': 23, '000111': 4, '001110': 20, '100011': 4, '101001': 8, '011100': 43, '100010': 13, '001101': 11, '100101': 10, '100100': 20, '010000': 49, '000100': 43, '011101': 13, '111001': 11, '001001': 21, '011001': 12, '000101': 14, '101101': 7, '110101': 4, '101000': 29, '000011': 5, '011110': 10, '110010': 7, '010101': 9, '010111': 3, '111110': 6, '001011': 5, '111011': 7, '001111': 10, '110011': 2, '111010': 4, '101010': 5, '110111': 1, '110001': 4, '010011': 3, '011011': 2, '011111': 3, '110110': 1}, 2: {'1010000': 16, '1000100': 24, '0000100': 43, '0010010': 29, '1010100': 20, '0001100': 22, '0010001': 10, '1010001': 12, '1010010': 13, '0000110': 40, '0001101': 13, '1000101': 9, '0011110': 4, '1010101': 6, '0000001': 29, '0010101': 19, '0000010': 32, '1000010': 18, '0110000': 8, '1000111': 10, '0010000': 36, '0010111': 16, '0101100': 3, '0010110': 28, '1110101': 4, '0011000': 18, '0100110': 6, '0000011': 9, '0101010': 2, '1110011': 2, '0001111': 6, '0000000': 34, '0010100': 29, '0010011': 16, '0001000': 12, '1010110': 12, '0111011': 1, '1101010': 1, '1001010': 3, '1100001': 2, '1000110': 21, '0011011': 5, '1011111': 5, '1100011': 3, '1101000': 2, '1000000': 13, '1100000': 2, '0000111': 25, '0001010': 9, '1111110': 2, '0000101': 21, '1010111': 6, '1101110': 1, '0110110': 6, '1000001': 8, '1001100': 4, '0001001': 8, '1001111': 6, '0011100': 13, '0011010': 12, '1011000': 6, '0001110': 18, '1011101': 3, '1100010': 1, '0100010': 5, '0011101': 12, '1110001': 2, '0001011': 8, '0011111': 5, '1011011': 3, '0100101': 5, '1001110': 8, '1110010': 2, '0110001': 3, '0100100': 8, '1000011': 5, '0110101': 2, '0110011': 4, '1100110': 2, '1010011': 5, '0100111': 3, '0101011': 2, '0011001': 13, '0110100': 8, '0110010': 5, '0111001': 2, '1110000': 3, '1011010': 6, '0111110': 2, '1011100': 3, '0100000': 5, '1001001': 5, '0111100': 3, '1011110': 5, '0101110': 2, '1001000': 5, '0111000': 1, '1110110': 2, '1100100': 5, '0100001': 3, '1111000': 1, '1111100': 2, '1111011': 1, '0101000': 2, '0111101': 2, '1011001': 2, '1001101': 2, '0101111': 2, '1110111': 2, '1101101': 1, '0100011': 3, '1101100': 1}, 3: {'0011110': 16, '1100010': 5, '0010100': 16, '0001111': 11, '0101100': 17, '0010101': 8, '1001101': 9, '0101010': 17, '0000011': 19, '0110111': 3, '0000010': 22, '0000000': 29, '0010001': 5, '0011011': 9, '0100110': 8, '0100010': 21, '0011000': 15, '1000101': 8, '0001010': 19, '1010011': 2, '1001000': 10, '1101100': 6, '1000111': 5, '1111101': 2, '0110000': 12, '0111000': 8, '0101001': 14, '0000110': 13, '1110110': 7, '0001100': 17, '0001110': 15, '0000101': 13, '0011010': 16, '0111111': 6, '0010110': 9, '0111100': 6, '1011011': 4, '1001111': 3, '0011100': 14, '0101000': 22, '1110011': 2, '0101110': 9, '1011111': 1, '0110110': 7, '0001101': 15, '1100101': 5, '1100100': 6, '1000010': 4, '0010010': 14, '1111001': 4, '1000001': 6, '0101101': 9, '0011101': 10, '1010000': 3, '0111010': 14, '0101011': 10, '1101011': 6, '0001011': 18, '1101001': 4, '0100001': 4, '1110111': 4, '1111110': 3, '1100111': 6, '1110101': 2, '1010110': 3, '1101010': 10, '1111100': 3, '0001001': 19, '0110001': 8, '0110010': 10, '0110011': 8, '0001000': 28, '0000100': 12, '1100000': 7, '0100000': 12, '1001011': 10, '1011101': 2, '1111010': 2, '1001010': 10, '1101110': 8, '1101101': 6, '0100111': 10, '1111011': 4, '0100011': 12, '1010010': 1, '0010111': 5, '0100100': 12, '0000001': 13, '0111001': 7, '0111110': 4, '1011110': 4, '1100011': 4, '0010011': 10, '0000111': 11, '1100110': 3, '1011000': 2, '1111111': 3, '1010001': 2, '1010100': 4, '0100101': 10, '0011111': 9, '0010000': 10, '1000110': 4, '1110000': 2, '1001110': 2, '1001001': 3, '1000000': 7, '1101111': 4, '1101000': 4, '0101111': 7, '1011010': 5, '1011001': 4, '1001100': 6, '1110100': 2, '0011001': 3, '0111011': 2, '1000100': 6, '1100001': 1, '1110001': 2, '1000011': 1, '0111101': 2, '0110100': 3, '1110010': 2, '0110101': 1, '1011100': 1, '1111000': 1}, 9: {'0100000': 8, '0000101': 17, '0000100': 18, '1100011': 4, '0011001': 11, '0110100': 2, '0011011': 9, '1011000': 15, '0000001': 29, '0010010': 20, '1001000': 12, '1010111': 5, '1000111': 7, '0010110': 16, '0010100': 15, '0001011': 15, '1100010': 7, '0110001': 15, '0010001': 27, '1000010': 12, '0010000': 24, '0100001': 12, '0111000': 1, '1001011': 7, '1000000': 15, '1000100': 4, '1000110': 7, '1101000': 7, '0100110': 2, '0000111': 18, '1010010': 14, '1010000': 14, '1111111': 3, '0110011': 7, '0001001': 18, '1000011': 10, '0001101': 16, '1010011': 11, '1111000': 6, '1101011': 3, '1110101': 4, '0000010': 16, '0001100': 9, '1011010': 8, '1110010': 6, '0101000': 8, '0001110': 7, '0000011': 20, '0100101': 8, '1011001': 4, '1110111': 6, '1110110': 4, '0110000': 10, '0100011': 6, '0011010': 10, '0010011': 25, '0000110': 7, '0011110': 7, '0011000': 9, '0111100': 5, '1010001': 9, '0000000': 28, '1110011': 5, '1010101': 6, '0100010': 9, '0101111': 2, '0010111': 15, '1111101': 2, '1010110': 4, '0101100': 2, '0011101': 11, '0010101': 7, '1110001': 4, '0111111': 5, '1000101': 7, '1110000': 8, '1100101': 2, '0110101': 10, '0011111': 6, '1001111': 5, '0111011': 6, '0111010': 5, '1001001': 15, '0001010': 11, '0011100': 8, '1010100': 4, '0110110': 3, '1001100': 5, '0100100': 5, '0101001': 6, '1111010': 2, '0101011': 4, '1011110': 6, '1001101': 4, '1011100': 3, '1001010': 8, '0001111': 6, '0111001': 6, '1111001': 5, '1011011': 8, '1011101': 3, '1100000': 1, '1111100': 1, '0101110': 5, '1001110': 4, '1100110': 2, '0101101': 1, '1011111': 3, '1100001': 6, '0110010': 6, '1101111': 2, '0101010': 4, '0001000': 13, '0111110': 1, '1101010': 3, '1101100': 3, '0100111': 2, '0111101': 3, '0110111': 6, '1000001': 10, '1101110': 2, '1100111': 2, '1100100': 1, '1110100': 2, '1111011': 2, '1111110': 1, '1101001': 2}}
[PROCESS FINISH] Process 0 finished all shots at time 205.79231548309326.
[PROCESS FIDELITY] Process 0 fidelity: 0.279
[PROCESS WAITING TIME] Process 0 waiting time: 204.08953094482422 seconds
[PROCESS FINISH] Process 1 finished all shots at time 205.79935503005981.
[PROCESS FIDELITY] Process 1 fidelity: 0.08999999999999997
[PROCESS WAITING TIME] Process 1 waiting time: 201.83923649787903 seconds
[PROCESS FINISH] Process 2 finished all shots at time 205.8064877986908.
[PROCESS FIDELITY] Process 2 fidelity: 0.0
[PROCESS WAITING TIME] Process 2 waiting time: 201.42002630233765 seconds
[PROCESS FINISH] Process 3 finished all shots at time 205.81448698043823.
[PROCESS FIDELITY] Process 3 fidelity: 0.0030000000000000027
[PROCESS WAITING TIME] Process 3 waiting time: 201.2436022758484 seconds
[PROCESS FINISH] Process 4 finished all shots at time 205.81448698043823.
[PROCESS FIDELITY] Process 4 fidelity: 0.1299999999999999
[PROCESS WAITING TIME] Process 4 waiting time: 197.52824997901917 seconds
[PROCESS FINISH] Process 5 finished all shots at time 205.8238010406494.
[PROCESS FIDELITY] Process 5 fidelity: 0.29899999999999993
[PROCESS WAITING TIME] Process 5 waiting time: 196.04939079284668 seconds
[PROCESS FINISH] Process 6 finished all shots at time 205.8238010406494.
[PROCESS FIDELITY] Process 6 fidelity: 0.07000000000000006
[PROCESS WAITING TIME] Process 6 waiting time: 195.99808478355408 seconds
[PROCESS FINISH] Process 7 finished all shots at time 205.8238010406494.
[PROCESS FIDELITY] Process 7 fidelity: 1.1102230246251565e-15
[PROCESS WAITING TIME] Process 7 waiting time: 195.54929161071777 seconds
[PROCESS FINISH] Process 8 finished all shots at time 205.83081817626953.
[PROCESS FIDELITY] Process 8 fidelity: 0.07299999999999995
[PROCESS WAITING TIME] Process 8 waiting time: 195.50943875312805 seconds
[PROCESS FINISH] Process 9 finished all shots at time 205.83081817626953.
[PROCESS FIDELITY] Process 9 fidelity: 0.003000000000001446
[PROCESS WAITING TIME] Process 9 waiting time: 193.40457248687744 seconds
[PROCESS FINISH] Process 10 finished all shots at time 205.83183073997498.
[PROCESS FIDELITY] Process 10 fidelity: 0.09199999999999997
[PROCESS WAITING TIME] Process 10 waiting time: 192.09106397628784 seconds
[PROCESS FINISH] Process 11 finished all shots at time 205.83183073997498.
[PROCESS FIDELITY] Process 11 fidelity: 0.30299999999999994
[PROCESS WAITING TIME] Process 11 waiting time: 191.09424471855164 seconds
[PROCESS FINISH] Process 12 finished all shots at time 205.83916926383972.
[PROCESS FIDELITY] Process 12 fidelity: 0.28400000000000003
[PROCESS WAITING TIME] Process 12 waiting time: 188.33771395683289 seconds
[PROCESS FINISH] Process 13 finished all shots at time 205.83916926383972.
[PROCESS FIDELITY] Process 13 fidelity: 0.18100000000000005
[PROCESS WAITING TIME] Process 13 waiting time: 185.964693069458 seconds
[PROCESS FINISH] Process 14 finished all shots at time 205.8461308479309.
[PROCESS FIDELITY] Process 14 fidelity: 0.028000000000000025
[PROCESS WAITING TIME] Process 14 waiting time: 183.970885515213 seconds
[PROCESS FINISH] Process 15 finished all shots at time 205.8536512851715.
[PROCESS FIDELITY] Process 15 fidelity: 0.05700000000000016
[PROCESS WAITING TIME] Process 15 waiting time: 183.43189454078674 seconds
[PROCESS FINISH] Process 16 finished all shots at time 205.85465121269226.
[PROCESS FIDELITY] Process 16 fidelity: 0.05400000000000005
[PROCESS WAITING TIME] Process 16 waiting time: 178.17717862129211 seconds
[PROCESS FINISH] Process 17 finished all shots at time 205.85465121269226.
[PROCESS FIDELITY] Process 17 fidelity: 0.048000000000000265
[PROCESS WAITING TIME] Process 17 waiting time: 177.99454808235168 seconds
[BATCH] Process batch with [18, 19, 20, 21, 22, 23, 24, 25, 26, 27] selected with min shots 1000.
[UTILITY] New batch has utility 0.5413533834586466.
[PROCESS COUNT] New batch has 10 processes.
[SHARING RATIO] New batch has helper qubit sharing ratio 0.0.
[HARDWARE RESULT] {24: {'100': 265, '000': 263, '010': 168, '110': 145, '101': 46, '011': 42, '001': 39, '111': 32}, 26: {'010': 156, '100': 94, '110': 34, '000': 482, '101': 27, '001': 149, '011': 54, '111': 4}, 21: {'101': 181, '011': 110, '100': 111, '000': 140, '010': 85, '110': 92, '001': 178, '111': 103}, 27: {'110': 78, '000': 176, '001': 143, '010': 169, '101': 83, '100': 133, '011': 127, '111': 91}, 20: {'1100': 105, '0011': 24, '0100': 155, '0101': 52, '1111': 29, '0000': 99, '1101': 34, '0010': 89, '1110': 70, '1000': 67, '0110': 87, '0001': 48, '1011': 14, '0111': 60, '1001': 28, '1010': 39}, 18: {'1011': 52, '0000': 64, '0100': 67, '0101': 60, '1010': 75, '1100': 71, '1001': 74, '0001': 53, '0011': 63, '1111': 54, '1101': 52, '0010': 68, '1000': 83, '1110': 72, '0110': 50, '0111': 42}, 19: {'0000': 181, '1100': 35, '1010': 84, '0100': 53, '0010': 156, '0001': 100, '1001': 37, '1011': 36, '0110': 35, '0101': 25, '1101': 21, '0011': 59, '1000': 116, '0111': 27, '1110': 26, '1111': 9}, 22: {'1111': 66, '1011': 81, '0010': 62, '0111': 47, '0100': 47, '0000': 81, '1001': 65, '1110': 52, '1000': 85, '0110': 55, '1100': 49, '0011': 65, '0001': 78, '1101': 53, '1010': 68, '0101': 46}, 23: {'0100': 135, '1111': 13, '0001': 121, '0011': 58, '1000': 39, '0000': 155, '0010': 82, '0101': 129, '0110': 91, '1001': 25, '1010': 26, '1011': 7, '0111': 57, '1100': 24, '1110': 17, '1101': 21}, 25: {'0110': 69, '0000': 115, '1000': 84, '0010': 58, '1011': 50, '1001': 62, '1101': 42, '1100': 85, '0001': 68, '1110': 55, '0100': 82, '0011': 43, '0111': 34, '1111': 32, '1010': 71, '0101': 50}}
[PROCESS FINISH] Process 18 finished all shots at time 368.8560929298401.
[PROCESS FIDELITY] Process 18 fidelity: 0.05400000000000005
[PROCESS WAITING TIME] Process 18 waiting time: 340.8202443122864 seconds
[PROCESS FINISH] Process 19 finished all shots at time 368.85709953308105.
[PROCESS FIDELITY] Process 19 fidelity: 0.009000000000000008
[PROCESS WAITING TIME] Process 19 waiting time: 339.266526222229 seconds
[PROCESS FINISH] Process 20 finished all shots at time 368.85709953308105.
[PROCESS FIDELITY] Process 20 fidelity: 0.09899999999999998
[PROCESS WAITING TIME] Process 20 waiting time: 337.7623498439789 seconds
[PROCESS FINISH] Process 21 finished all shots at time 368.85709953308105.
[PROCESS FIDELITY] Process 21 fidelity: 0.10299999999999998
[PROCESS WAITING TIME] Process 21 waiting time: 335.98334407806396 seconds
[PROCESS FINISH] Process 22 finished all shots at time 368.85810136795044.
[PROCESS FIDELITY] Process 22 fidelity: 0.06600000000000006
[PROCESS WAITING TIME] Process 22 waiting time: 334.73845410346985 seconds
[PROCESS FINISH] Process 23 finished all shots at time 368.85810136795044.
[PROCESS FIDELITY] Process 23 fidelity: 0.013000000000000012
[PROCESS WAITING TIME] Process 23 waiting time: 334.10732555389404 seconds
[PROCESS FINISH] Process 24 finished all shots at time 368.85810136795044.
[PROCESS FIDELITY] Process 24 fidelity: 0.263
[PROCESS WAITING TIME] Process 24 waiting time: 332.9090356826782 seconds
[PROCESS FINISH] Process 25 finished all shots at time 368.85810136795044.
[PROCESS FIDELITY] Process 25 fidelity: 0.03200000000000025
[PROCESS WAITING TIME] Process 25 waiting time: 332.644731760025 seconds
[PROCESS FINISH] Process 26 finished all shots at time 368.85910081863403.
[PROCESS FIDELITY] Process 26 fidelity: 0.482
[PROCESS WAITING TIME] Process 26 waiting time: 331.5797312259674 seconds
[PROCESS FINISH] Process 27 finished all shots at time 368.85910081863403.
[PROCESS FIDELITY] Process 27 fidelity: 0.09099999999999997
[PROCESS WAITING TIME] Process 27 waiting time: 328.57980012893677 seconds
[STOP] Scheduling stopped at time 369.86037588119507.
------------------Statistics:---------------------------------Total running time: 369.63770389556885
Finished process count: 28
Throughput: 
0.07574984831068707
----------------------Batch statistics-----------------------:
Batch 0: Number of processes: 18, Qubit utilization: 0.9398496240601504
Batch 1: Number of processes: 10, Qubit utilization: 0.5413533834586466
Batch 0: Shared ratio: 0.28888888888888886
Batch 1: Shared ratio: 0.0
Average shared ratio per batch: 0.14444444444444443
Average number of processes per batch: 14.0
Average qubit utility per batch: 0.7406015037593985
----------------------Process waiting times-----------------------:
Process 0: 204.08953094482422
Process 1: 201.83923649787903
Process 2: 201.42002630233765
Process 3: 201.2436022758484
Process 4: 197.52824997901917
Process 5: 196.04939079284668
Process 6: 195.99808478355408
Process 7: 195.54929161071777
Process 8: 195.50943875312805
Process 9: 193.40457248687744
Process 10: 192.09106397628784
Process 11: 191.09424471855164
Process 12: 188.33771395683289
Process 13: 185.964693069458
Process 14: 183.970885515213
Process 15: 183.43189454078674
Process 16: 178.17717862129211
Process 17: 177.99454808235168
Process 18: 340.8202443122864
Process 19: 339.266526222229
Process 20: 337.7623498439789
Process 21: 335.98334407806396
Process 22: 334.73845410346985
Process 23: 334.10732555389404
Process 24: 332.9090356826782
Process 25: 332.644731760025
Process 26: 331.5797312259674
Process 27: 328.57980012893677
Average waiting time across all processes: 243.288756779262
----------------------Process fidelities-----------------------:
Process 0: 0.279
Process 1: 0.08999999999999997
Process 2: 0.0
Process 3: 0.0030000000000000027
Process 4: 0.1299999999999999
Process 5: 0.29899999999999993
Process 6: 0.07000000000000006
Process 7: 1.1102230246251565e-15
Process 8: 0.07299999999999995
Process 9: 0.003000000000001446
Process 10: 0.09199999999999997
Process 11: 0.30299999999999994
Process 12: 0.28400000000000003
Process 13: 0.18100000000000005
Process 14: 0.028000000000000025
Process 15: 0.05700000000000016
Process 16: 0.05400000000000005
Process 17: 0.048000000000000265
Process 18: 0.05400000000000005
Process 19: 0.009000000000000008
Process 20: 0.09899999999999998
Process 21: 0.10299999999999998
Process 22: 0.06600000000000006
Process 23: 0.013000000000000012
Process 24: 0.263
Process 25: 0.03200000000000025
Process 26: 0.482
Process 27: 0.09099999999999997
Average fidelity across all processes: 0.11450000000000007
