----------------------Log:---------------------------------
[ADD] Process 0 added to the queue at time 1.7014005184173584, shots: 1000.
[ADD] Process 1 added to the queue at time 3.960322856903076, shots: 1000.
[ADD] Process 2 added to the queue at time 4.382096290588379, shots: 1000.
[ADD] Process 3 added to the queue at time 4.565988063812256, shots: 1000.
[ADD] Process 4 added to the queue at time 8.278465509414673, shots: 1000.
[ADD] Process 5 added to the queue at time 9.767203330993652, shots: 1000.
[ADD] Process 6 added to the queue at time 9.819056510925293, shots: 1000.
[BATCH] Process batch with [0, 1, 2, 3, 4, 5, 6] selected with min shots 1000.
[ADD] Process 7 added to the queue at time 10.275417566299438, shots: 1000.
[ADD] Process 8 added to the queue at time 10.582639694213867, shots: 1000.
[ADD] Process 9 added to the queue at time 10.665956497192383, shots: 1000.
[ADD] Process 10 added to the queue at time 13.126091957092285, shots: 1000.
[ADD] Process 11 added to the queue at time 13.499475479125977, shots: 1000.
[ADD] Process 12 added to the queue at time 18.6756808757782, shots: 1000.
[ADD] Process 13 added to the queue at time 22.646500825881958, shots: 1000.
[ADD] Process 14 added to the queue at time 22.988268852233887, shots: 1000.
[ADD] Process 15 added to the queue at time 25.207614183425903, shots: 1000.
[ADD] Process 16 added to the queue at time 26.245237112045288, shots: 1000.
[ADD] Process 17 added to the queue at time 26.94225811958313, shots: 1000.
[ADD] Process 18 added to the queue at time 27.52389645576477, shots: 1000.
[ADD] Process 19 added to the queue at time 30.228431701660156, shots: 1000.
[ADD] Process 20 added to the queue at time 31.27660322189331, shots: 1000.
[ADD] Process 21 added to the queue at time 33.521366357803345, shots: 1000.
[ADD] Process 22 added to the queue at time 36.24766230583191, shots: 1000.
[ADD] Process 23 added to the queue at time 36.582414627075195, shots: 1000.
[ADD] Process 24 added to the queue at time 37.24827241897583, shots: 1000.
[ADD] Process 25 added to the queue at time 41.64351963996887, shots: 1000.
[UTILITY] New batch has utility 0.39097744360902253.
[PROCESS COUNT] New batch has 7 processes.
[BATCH] Process batch with [7, 8, 9, 10, 11, 12, 14] selected with min shots 1000.
[HARDWARE RESULT] {0: {'01': 75, '00': 855, '11': 10, '10': 60}, 5: {'00': 912, '10': 36, '01': 45, '11': 7}, 4: {'11': 781, '01': 99, '10': 103, '00': 17}, 1: {'111': 633, '100': 29, '011': 91, '110': 131, '010': 30, '000': 9, '101': 64, '001': 13}, 6: {'100': 88, '101': 186, '111': 134, '110': 63, '001': 187, '011': 155, '010': 77, '000': 110}, 2: {'0111101': 11, '0011111': 31, '1001011': 4, '0011110': 4, '1111111': 36, '0111010': 7, '1001110': 1, '1011111': 33, '1101011': 6, '0110111': 83, '1011010': 1, '0010111': 34, '0011001': 4, '1100111': 18, '0010010': 5, '0110101': 14, '1110011': 21, '1100101': 5, '1010111': 26, '0101100': 2, '0110110': 16, '0010110': 7, '1011101': 3, '0111111': 64, '0010011': 15, '1111010': 12, '1110100': 4, '0100111': 16, '1001101': 5, '0000011': 6, '0110011': 21, '0111110': 13, '0101011': 8, '1111011': 14, '1011110': 2, '1100011': 4, '0100010': 3, '1110101': 12, '1010010': 2, '1100001': 2, '1101111': 12, '0100110': 5, '0011011': 11, '0010101': 11, '0000101': 2, '1110111': 47, '0111001': 11, '1111101': 12, '1011011': 14, '0101111': 21, '0001011': 7, '1100110': 5, '1111110': 10, '1110010': 3, '0100101': 8, '1000111': 5, '1110001': 8, '1001010': 2, '0100011': 13, '0001101': 4, '0111011': 25, '0101101': 6, '1010001': 10, '0110100': 6, '0111000': 4, '1101010': 2, '0001100': 1, '1000011': 8, '0010001': 5, '1010110': 6, '0110001': 5, '0011101': 5, '1111001': 11, '0110010': 5, '1110110': 9, '0001110': 1, '1001111': 7, '1010101': 10, '1010011': 16, '1000110': 3, '0000111': 5, '1010100': 3, '0001111': 6, '0110000': 2, '1111000': 4, '1001001': 3, '0101110': 6, '0111100': 2, '0101000': 1, '0001010': 1, '1101101': 4, '1001000': 1, '0010100': 1, '0100001': 3, '0011010': 2, '0100000': 1, '0000001': 1, '1000101': 1, '0011000': 1, '0011100': 2, '1011100': 2, '1011001': 1, '1101110': 3, '1000001': 1, '1100010': 2, '1010000': 2, '0101001': 2, '1110000': 2, '1000100': 1, '1101001': 1, '0001001': 1, '0000100': 1}, 3: {'1100010': 6, '0001110': 9, '0010101': 12, '1011100': 9, '0000001': 15, '1011101': 3, '0000111': 7, '1101100': 4, '0010110': 19, '1010011': 10, '0001111': 5, '1101000': 3, '0001100': 5, '1101001': 4, '0101001': 6, '1011110': 6, '1010001': 10, '0010100': 18, '1000110': 5, '0100111': 5, '0000010': 16, '0000101': 15, '1000011': 5, '1110110': 11, '0111110': 10, '0000011': 7, '0101110': 7, '1011010': 10, '0010111': 12, '0110001': 10, '0111001': 7, '0010000': 20, '1010010': 7, '0100110': 7, '0100100': 4, '0111000': 6, '1100101': 4, '1110010': 9, '0101101': 2, '1110001': 12, '0100000': 11, '0100101': 9, '0000000': 14, '1110100': 11, '1010111': 11, '0101100': 8, '1011000': 16, '0010010': 15, '0110011': 12, '0111101': 7, '0110111': 10, '1111010': 8, '0110100': 11, '1111000': 14, '0001001': 7, '0110101': 7, '1001000': 6, '0001000': 8, '0111111': 8, '1111111': 2, '0011010': 12, '0011100': 10, '1000101': 4, '0110000': 15, '1010100': 10, '0011000': 11, '0010011': 14, '0010001': 13, '1100111': 7, '1100110': 7, '0101000': 7, '0100011': 10, '1100000': 9, '1101011': 5, '1001111': 3, '1000100': 16, '1111001': 5, '0011110': 10, '0100001': 7, '1111011': 2, '1000001': 7, '1000111': 4, '0111011': 5, '1000000': 12, '0110010': 11, '1100001': 8, '1100011': 6, '1100100': 8, '0000100': 10, '0001011': 4, '1001101': 4, '1001010': 7, '1110000': 14, '1101101': 2, '1111101': 10, '0100010': 7, '1010000': 9, '1010101': 8, '0011001': 10, '0001010': 9, '1110101': 6, '1110111': 5, '0111010': 6, '0000110': 12, '1101010': 4, '1110011': 5, '0011011': 6, '1010110': 6, '1000010': 5, '1001110': 3, '1011111': 4, '0011111': 3, '0011101': 11, '0111100': 9, '1001011': 3, '1001001': 4, '1011001': 8, '1101111': 1, '0101011': 3, '0001101': 2, '1011011': 3, '1001100': 5, '1111100': 6, '1111110': 2, '0101111': 3, '0110110': 1, '0101010': 3, '1101110': 2}}
[PROCESS FINISH] Process 0 finished all shots at time 134.1813793182373.
[PROCESS FIDELITY] Process 0 fidelity: 0.855
[PROCESS WAITING TIME] Process 0 waiting time: 132.47997879981995 seconds
[PROCESS FINISH] Process 1 finished all shots at time 134.1813793182373.
[PROCESS FIDELITY] Process 1 fidelity: 0.633
[PROCESS WAITING TIME] Process 1 waiting time: 130.22105646133423 seconds
[PROCESS FINISH] Process 2 finished all shots at time 134.1813793182373.
[PROCESS FIDELITY] Process 2 fidelity: 0.03600000000000059
[PROCESS WAITING TIME] Process 2 waiting time: 129.79928302764893 seconds
[PROCESS FINISH] Process 3 finished all shots at time 134.1813793182373.
[PROCESS FIDELITY] Process 3 fidelity: 0.002000000000000224
[PROCESS WAITING TIME] Process 3 waiting time: 129.61539125442505 seconds
[PROCESS FINISH] Process 4 finished all shots at time 134.1813793182373.
[PROCESS FIDELITY] Process 4 fidelity: 0.781
[PROCESS WAITING TIME] Process 4 waiting time: 125.90291380882263 seconds
[PROCESS FINISH] Process 5 finished all shots at time 134.1813793182373.
[PROCESS FIDELITY] Process 5 fidelity: 0.912
[PROCESS WAITING TIME] Process 5 waiting time: 124.41417598724365 seconds
[PROCESS FINISH] Process 6 finished all shots at time 134.1846137046814.
[PROCESS FIDELITY] Process 6 fidelity: 0.134
[PROCESS WAITING TIME] Process 6 waiting time: 124.3655571937561 seconds
[UTILITY] New batch has utility 0.46616541353383456.
[PROCESS COUNT] New batch has 7 processes.
[BATCH] Process batch with [13, 15, 16, 17, 18, 19, 20] selected with min shots 1000.
[HARDWARE RESULT] {12: {'00': 894, '01': 71, '10': 24, '11': 11}, 8: {'01': 320, '10': 190, '00': 251, '11': 239}, 11: {'0011': 7, '0000': 489, '0100': 341, '1110': 2, '0010': 29, '0110': 22, '0101': 26, '1000': 21, '0001': 41, '1100': 14, '1001': 4, '0111': 2, '1101': 2}, 14: {'0111': 131, '0001': 128, '0000': 102, '0100': 124, '0011': 87, '0010': 60, '0101': 108, '1100': 19, '1010': 20, '1111': 15, '1000': 25, '1001': 23, '0110': 96, '1110': 13, '1101': 20, '1011': 29}, 7: {'101000': 41, '000000': 24, '000110': 12, '101010': 18, '110001': 4, '101100': 52, '110100': 10, '100100': 53, '001110': 22, '101011': 16, '111001': 7, '001101': 24, '001111': 11, '100101': 42, '001000': 23, '110111': 12, '000010': 14, '000100': 48, '110101': 10, '100110': 28, '110000': 8, '000101': 19, '110110': 11, '101110': 26, '010111': 5, '111101': 5, '011000': 7, '011111': 4, '101111': 28, '001100': 32, '100000': 37, '101001': 22, '111111': 10, '001001': 10, '010110': 3, '011100': 10, '000111': 17, '110010': 6, '111100': 14, '111110': 11, '101101': 42, '010100': 15, '111000': 6, '111011': 8, '100001': 27, '000001': 18, '001010': 9, '001011': 8, '100111': 18, '100010': 22, '100011': 8, '111010': 5, '000011': 8, '011010': 3, '011011': 4, '010010': 3, '011101': 3, '011001': 4, '010001': 6, '010000': 10, '010101': 10, '011110': 4, '010011': 1, '110011': 2}, 9: {'1100000': 102, '1110000': 94, '0010000': 83, '0000000': 81, '1010000': 85, '0100000': 95, '0110001': 5, '1000000': 89, '0011000': 6, '1110100': 11, '0110000': 97, '0100100': 13, '1011000': 10, '1100100': 14, '1010100': 14, '1111000': 13, '1010001': 8, '0000100': 16, '0001100': 2, '1001000': 9, '0111000': 12, '1101000': 7, '1001100': 1, '1001001': 1, '0001000': 13, '1011100': 3, '0110100': 8, '1110010': 4, '1000100': 8, '0010010': 6, '0010101': 1, '1000001': 4, '1110111': 1, '0000001': 3, '1011001': 2, '1101100': 3, '0110010': 3, '0000011': 1, '1110101': 1, '0101000': 6, '1100001': 6, '0100001': 3, '0010100': 9, '0111001': 1, '0010001': 5, '0001001': 2, '0000110': 1, '0111100': 2, '0100010': 4, '0000010': 1, '1000010': 3, '0110011': 1, '1110001': 3, '0010011': 3, '1010101': 3, '0001111': 1, '0000111': 1, '1011101': 1, '1110110': 1, '0110101': 1, '0101100': 1, '1101001': 1, '1001110': 1, '1100011': 1, '0110110': 1, '1010110': 1, '1001010': 1, '0111101': 1, '0011100': 1, '0100110': 1, '1100010': 1, '0101110': 1, '1000101': 1}, 10: {'1100000': 7, '0100101': 11, '0110001': 14, '1011100': 19, '0011011': 1, '1111101': 69, '0111100': 20, '1011101': 21, '1000101': 11, '1110101': 31, '1111001': 41, '1011001': 14, '0011110': 8, '1111111': 10, '1111110': 12, '0011001': 5, '0101100': 10, '1010111': 5, '0110101': 10, '1100111': 7, '0111101': 26, '1110001': 20, '1010110': 11, '1100010': 3, '1101101': 31, '0101101': 6, '0111000': 7, '1011111': 10, '0111110': 8, '1111000': 15, '1011000': 12, '1100101': 20, '1101001': 21, '0010101': 3, '0111001': 17, '0101001': 6, '0101000': 8, '1000111': 1, '0100011': 5, '0000101': 4, '0000110': 3, '1110100': 26, '1110010': 8, '0011101': 10, '1111011': 9, '0101110': 1, '1101100': 26, '1010010': 3, '1100001': 4, '0101011': 2, '0100111': 2, '0010111': 1, '1001111': 2, '1101010': 5, '0110110': 6, '1111100': 39, '1000100': 7, '0001101': 5, '1000001': 3, '1110011': 6, '0100001': 6, '1010101': 14, '1001101': 12, '1110111': 9, '1110000': 20, '0111111': 5, '0111010': 4, '1010001': 7, '0111011': 6, '1010011': 3, '0110100': 14, '1001001': 5, '1101110': 8, '1101011': 2, '1101000': 8, '0101111': 4, '0010011': 1, '1100100': 11, '1011011': 1, '0110000': 10, '1111010': 13, '0010001': 3, '0000111': 1, '1101111': 6, '1010000': 5, '0110010': 2, '0000010': 2, '0011100': 5, '1110110': 7, '0001110': 1, '1001011': 3, '1011110': 5, '0100000': 1, '1010100': 7, '0000011': 1, '0110111': 2, '1100110': 8, '0100100': 3, '1000000': 4, '1001100': 11, '0001011': 1, '0001001': 3, '0001111': 1, '0011111': 2, '0100110': 3, '0010010': 1, '0011000': 1, '0011010': 2, '1001000': 5, '1100011': 1, '0010100': 1, '0000100': 2, '0010000': 1, '0001100': 1, '0110011': 1, '1000110': 2, '0001010': 1, '0000000': 1, '0000001': 2}}
[PROCESS FINISH] Process 7 finished all shots at time 254.01453232765198.
[PROCESS FIDELITY] Process 7 fidelity: 0.010000000000000009
[PROCESS WAITING TIME] Process 7 waiting time: 243.73911476135254 seconds
[PROCESS FINISH] Process 8 finished all shots at time 254.01453232765198.
[PROCESS FIDELITY] Process 8 fidelity: 0.239
[PROCESS WAITING TIME] Process 8 waiting time: 243.4318926334381 seconds
[PROCESS FINISH] Process 9 finished all shots at time 254.02410411834717.
[PROCESS FIDELITY] Process 9 fidelity: 0.0810000000000003
[PROCESS WAITING TIME] Process 9 waiting time: 243.35814762115479 seconds
[PROCESS FINISH] Process 10 finished all shots at time 254.02877354621887.
[PROCESS FIDELITY] Process 10 fidelity: 0.010000000000000564
[PROCESS WAITING TIME] Process 10 waiting time: 240.9026815891266 seconds
[PROCESS FINISH] Process 11 finished all shots at time 254.03230023384094.
[PROCESS FIDELITY] Process 11 fidelity: 0.489
[PROCESS WAITING TIME] Process 11 waiting time: 240.53282475471497 seconds
[PROCESS FINISH] Process 12 finished all shots at time 254.0364339351654.
[PROCESS FIDELITY] Process 12 fidelity: 0.894
[PROCESS WAITING TIME] Process 12 waiting time: 235.3607530593872 seconds
[PROCESS FINISH] Process 14 finished all shots at time 254.04143357276917.
[PROCESS FIDELITY] Process 14 fidelity: 0.10200000000000009
[PROCESS WAITING TIME] Process 14 waiting time: 231.05316472053528 seconds
[UTILITY] New batch has utility 0.45112781954887216.
[PROCESS COUNT] New batch has 7 processes.
[HARDWARE RESULT] {15: {'01': 61, '00': 839, '10': 89, '11': 11}, 18: {'0000': 642, '0010': 41, '0001': 115, '1000': 57, '0100': 85, '0101': 18, '1001': 9, '0011': 14, '0110': 4, '1010': 3, '1100': 4, '1101': 4, '0111': 2, '1011': 2}, 19: {'1100': 46, '1010': 112, '1000': 354, '0100': 36, '0000': 245, '1001': 30, '0011': 18, '0001': 17, '0010': 89, '1011': 16, '0110': 14, '1110': 16, '1101': 2, '0101': 3, '0111': 2}, 20: {'00000': 267, '01001': 46, '00011': 31, '00010': 52, '11000': 50, '01101': 8, '01000': 145, '10000': 56, '00110': 12, '00001': 41, '11001': 11, '10001': 23, '00111': 11, '01010': 42, '01011': 38, '11010': 13, '00101': 10, '10010': 15, '10011': 7, '10110': 3, '01100': 32, '01111': 7, '10100': 13, '00100': 35, '01110': 5, '11011': 12, '11100': 11, '10111': 2, '11111': 1, '11101': 1}, 13: {'00100': 9, '01000': 57, '01110': 24, '01001': 133, '11001': 98, '00101': 20, '10001': 34, '01101': 70, '10011': 20, '00001': 31, '01010': 40, '11000': 40, '10111': 9, '00010': 11, '01100': 28, '11101': 52, '01011': 49, '00011': 18, '10000': 15, '11011': 41, '11111': 17, '11010': 30, '11110': 19, '01111': 31, '11100': 31, '10110': 13, '10101': 20, '00000': 16, '00111': 6, '10100': 7, '10010': 5, '00110': 6}, 16: {'11101': 31, '10110': 48, '10101': 31, '10001': 19, '11110': 57, '01100': 44, '00100': 24, '01010': 34, '11100': 35, '01011': 22, '00111': 44, '10111': 37, '00101': 26, '10100': 34, '11010': 31, '11001': 20, '11111': 50, '00001': 15, '01111': 57, '01001': 20, '00010': 26, '11011': 25, '00110': 57, '01110': 62, '10000': 11, '01101': 23, '10010': 17, '01000': 25, '11000': 26, '10011': 18, '00000': 13, '00011': 18}, 17: {'00011': 101, '00001': 39, '10011': 119, '10111': 64, '00111': 64, '10110': 21, '11101': 18, '10001': 49, '11011': 84, '10000': 20, '00110': 22, '10100': 10, '10010': 38, '00010': 22, '11111': 43, '11010': 34, '01110': 2, '00100': 7, '11001': 40, '11000': 15, '01111': 19, '01100': 6, '01010': 12, '10101': 25, '11110': 9, '01001': 20, '01011': 40, '00101': 27, '01101': 5, '00000': 14, '11100': 9, '01000': 2}}
[PROCESS FINISH] Process 13 finished all shots at time 369.0748698711395.
[PROCESS FIDELITY] Process 13 fidelity: 0.017000000000000126
[PROCESS WAITING TIME] Process 13 waiting time: 346.42836904525757 seconds
[PROCESS FINISH] Process 15 finished all shots at time 369.07957339286804.
[PROCESS FIDELITY] Process 15 fidelity: 0.839
[PROCESS WAITING TIME] Process 15 waiting time: 343.87195920944214 seconds
[PROCESS FINISH] Process 16 finished all shots at time 369.07957339286804.
[PROCESS FIDELITY] Process 16 fidelity: 0.050000000000000044
[PROCESS WAITING TIME] Process 16 waiting time: 342.83433628082275 seconds
[PROCESS FINISH] Process 17 finished all shots at time 369.07957339286804.
[PROCESS FIDELITY] Process 17 fidelity: 0.04300000000000015
[PROCESS WAITING TIME] Process 17 waiting time: 342.1373152732849 seconds
[PROCESS FINISH] Process 18 finished all shots at time 369.07957339286804.
[PROCESS FIDELITY] Process 18 fidelity: 0.6419999999999999
[PROCESS WAITING TIME] Process 18 waiting time: 341.55567693710327 seconds
[PROCESS FINISH] Process 19 finished all shots at time 369.07957339286804.
[PROCESS FIDELITY] Process 19 fidelity: 0.245
[PROCESS WAITING TIME] Process 19 waiting time: 338.8511416912079 seconds
[PROCESS FINISH] Process 20 finished all shots at time 369.07957339286804.
[PROCESS FIDELITY] Process 20 fidelity: 0.2669999999999999
[PROCESS WAITING TIME] Process 20 waiting time: 337.80297017097473 seconds
[BATCH] Process batch with [21, 22, 23, 24, 25] selected with min shots 1000.
[UTILITY] New batch has utility 0.37593984962406013.
[PROCESS COUNT] New batch has 5 processes.
[HARDWARE RESULT] {23: {'00': 867, '01': 76, '10': 45, '11': 12}, 22: {'000': 764, '011': 9, '100': 71, '001': 114, '110': 2, '101': 11, '010': 29}, 24: {'010111': 6, '111011': 74, '111010': 88, '101010': 56, '000011': 6, '110011': 30, '100001': 10, '010011': 5, '110101': 6, '101110': 32, '101001': 24, '110010': 41, '010010': 13, '011001': 7, '000010': 5, '101011': 41, '111111': 43, '100010': 24, '111001': 27, '100111': 9, '110111': 20, '001011': 11, '110100': 8, '001001': 13, '011011': 24, '100101': 5, '011110': 8, '101101': 9, '111100': 21, '001110': 4, '011111': 13, '000110': 3, '111110': 48, '111000': 36, '110000': 13, '001111': 8, '011101': 6, '100011': 25, '001010': 14, '101000': 15, '101111': 18, '010101': 3, '100000': 6, '001000': 7, '100110': 13, '111101': 13, '011010': 20, '110001': 7, '000101': 1, '110110': 12, '010001': 4, '010110': 8, '011100': 5, '010000': 3, '011000': 5, '100100': 2, '101100': 8, '000001': 3, '001100': 3, '000000': 3, '010100': 4, '000100': 1}, 21: {'0000000': 193, '0000010': 108, '0001011': 24, '0001000': 48, '0100000': 37, '0001001': 26, '0000001': 140, '0100001': 30, '0000011': 77, '0010001': 17, '0111000': 1, '0101100': 2, '0000101': 15, '0001010': 24, '0100010': 30, '0100111': 4, '0100110': 4, '0001111': 6, '0101000': 6, '1100000': 3, '0111010': 2, '0000110': 19, '0010110': 3, '1000000': 7, '0100011': 16, '0100101': 5, '0000111': 6, '0011000': 4, '0010100': 3, '0000100': 19, '0010011': 9, '0011010': 6, '0001110': 4, '0010000': 21, '1010010': 2, '0010010': 14, '0110001': 4, '0101010': 3, '1000001': 7, '1000010': 4, '0101111': 1, '1001010': 1, '0100100': 4, '0101110': 2, '1001001': 1, '0110100': 1, '0010111': 1, '1000011': 4, '0001101': 5, '0011001': 3, '0001100': 5, '1100001': 1, '1001000': 2, '0010101': 2, '1011001': 1, '1100101': 1, '0111101': 1, '1010100': 1, '1000111': 1, '0101001': 1, '1000100': 1, '1100011': 1, '0111011': 1, '0011100': 1, '0101011': 1, '0110011': 1, '0110010': 1, '1000101': 1}, 25: {'0111000': 20, '0101011': 30, '0000001': 18, '0010010': 17, '0010011': 15, '0010001': 13, '0101001': 25, '0001010': 76, '0000110': 9, '0110011': 10, '0001101': 7, '0011001': 32, '0011011': 32, '0101000': 48, '0110111': 2, '0000010': 24, '0010111': 2, '0011010': 37, '0011101': 7, '0100000': 18, '0111011': 20, '0000111': 7, '0010000': 9, '0001000': 60, '0011000': 33, '0001110': 11, '0100101': 4, '0011100': 9, '0100011': 19, '0101110': 5, '0100010': 21, '0001111': 8, '0101101': 11, '0111001': 17, '0001100': 13, '0110100': 1, '0001011': 46, '0111010': 29, '0011110': 6, '0010110': 2, '0110001': 8, '0111111': 5, '0001001': 45, '0000011': 14, '0100110': 5, '0101100': 6, '0011111': 11, '0000000': 18, '0111101': 7, '0101010': 36, '0110010': 6, '0101111': 10, '0000100': 3, '0100001': 11, '0010101': 6, '0010100': 2, '0000101': 3, '0111110': 5, '0100111': 3, '1000000': 1, '0100100': 7, '0110000': 7, '0110101': 3, '0111100': 4, '1001010': 1}}
[PROCESS FINISH] Process 21 finished all shots at time 515.6686859130859.
[PROCESS FIDELITY] Process 21 fidelity: 0.19300000000000017
[PROCESS WAITING TIME] Process 21 waiting time: 482.1473195552826 seconds
[PROCESS FINISH] Process 22 finished all shots at time 515.6686859130859.
[PROCESS FIDELITY] Process 22 fidelity: 0.764
[PROCESS WAITING TIME] Process 22 waiting time: 479.421023607254 seconds
[PROCESS FINISH] Process 23 finished all shots at time 515.6686859130859.
[PROCESS FIDELITY] Process 23 fidelity: 0.867
[PROCESS WAITING TIME] Process 23 waiting time: 479.08627128601074 seconds
[PROCESS FINISH] Process 24 finished all shots at time 515.6714675426483.
[PROCESS FIDELITY] Process 24 fidelity: 0.04300000000000015
[PROCESS WAITING TIME] Process 24 waiting time: 478.4231951236725 seconds
[PROCESS FINISH] Process 25 finished all shots at time 515.6714675426483.
[PROCESS FIDELITY] Process 25 fidelity: 0.018000000000000016
[PROCESS WAITING TIME] Process 25 waiting time: 474.02794790267944 seconds
[STOP] Scheduling stopped at time 516.679185628891.
------------------Statistics:---------------------------------Total running time: 515.9289963245392
Finished process count: 26
Throughput: 
0.05039453138944142
----------------------Batch statistics-----------------------:
Batch 0: Number of processes: 7, Qubit utilization: 0.39097744360902253
Batch 1: Number of processes: 7, Qubit utilization: 0.46616541353383456
Batch 2: Number of processes: 7, Qubit utilization: 0.45112781954887216
Batch 3: Number of processes: 5, Qubit utilization: 0.37593984962406013
Average number of processes per batch: 6.5
Average qubit utility per batch: 0.42105263157894735
----------------------Process waiting times-----------------------:
Process 0: 132.47997879981995
Process 1: 130.22105646133423
Process 2: 129.79928302764893
Process 3: 129.61539125442505
Process 4: 125.90291380882263
Process 5: 124.41417598724365
Process 6: 124.3655571937561
Process 7: 243.73911476135254
Process 8: 243.4318926334381
Process 9: 243.35814762115479
Process 10: 240.9026815891266
Process 11: 240.53282475471497
Process 12: 235.3607530593872
Process 14: 231.05316472053528
Process 13: 346.42836904525757
Process 15: 343.87195920944214
Process 16: 342.83433628082275
Process 17: 342.1373152732849
Process 18: 341.55567693710327
Process 19: 338.8511416912079
Process 20: 337.80297017097473
Process 21: 482.1473195552826
Process 22: 479.421023607254
Process 23: 479.08627128601074
Process 24: 478.4231951236725
Process 25: 474.02794790267944
Average waiting time across all processes: 283.1447869906059
----------------------Process fidelities-----------------------:
Process 0: 0.855
Process 1: 0.633
Process 2: 0.03600000000000059
Process 3: 0.002000000000000224
Process 4: 0.781
Process 5: 0.912
Process 6: 0.134
Process 7: 0.010000000000000009
Process 8: 0.239
Process 9: 0.0810000000000003
Process 10: 0.010000000000000564
Process 11: 0.489
Process 12: 0.894
Process 14: 0.10200000000000009
Process 13: 0.017000000000000126
Process 15: 0.839
Process 16: 0.050000000000000044
Process 17: 0.04300000000000015
Process 18: 0.6419999999999999
Process 19: 0.245
Process 20: 0.2669999999999999
Process 21: 0.19300000000000017
Process 22: 0.764
Process 23: 0.867
Process 24: 0.04300000000000015
Process 25: 0.018000000000000016
Average fidelity across all processes: 0.3525384615384617
