----------------------Log:---------------------------------
[ADD] Process 0 added to the queue at time 1.7023534774780273, shots: 1000.
[ADD] Process 1 added to the queue at time 3.9590792655944824, shots: 1000.
[ADD] Process 2 added to the queue at time 4.381015777587891, shots: 1000.
[ADD] Process 3 added to the queue at time 6.2644243240356445, shots: 1000.
[ADD] Process 4 added to the queue at time 6.4170823097229, shots: 1000.
[ADD] Process 5 added to the queue at time 6.471869945526123, shots: 1000.
[ADD] Process 6 added to the queue at time 6.883796215057373, shots: 1000.
[ADD] Process 7 added to the queue at time 8.420776605606079, shots: 1000.
[ADD] Process 8 added to the queue at time 8.791291236877441, shots: 1000.
[ADD] Process 9 added to the queue at time 10.806422233581543, shots: 1000.
[ADD] Process 10 added to the queue at time 11.222767114639282, shots: 1000.
[ADD] Process 11 added to the queue at time 11.767752170562744, shots: 1000.
[ADD] Process 12 added to the queue at time 14.139712572097778, shots: 1000.
[ADD] Process 13 added to the queue at time 16.136963844299316, shots: 1000.
[ADD] Process 14 added to the queue at time 16.681092262268066, shots: 1000.
[BATCH] Process batch with [0, 1, 2, 3, 4, 5, 6, 7, 8, 9, 10, 11, 12, 13, 14] selected with min shots 1000.
[ADD] Process 15 added to the queue at time 21.936306476593018, shots: 1000.
[ADD] Process 16 added to the queue at time 24.328067779541016, shots: 1000.
[ADD] Process 17 added to the queue at time 24.523864030838013, shots: 1000.
[ADD] Process 18 added to the queue at time 24.819791078567505, shots: 1000.
[ADD] Process 19 added to the queue at time 26.690651416778564, shots: 1000.
[ADD] Process 20 added to the queue at time 31.451388359069824, shots: 1000.
[ADD] Process 21 added to the queue at time 33.33761405944824, shots: 1000.
[ADD] Process 22 added to the queue at time 35.39608073234558, shots: 1000.
[ADD] Process 23 added to the queue at time 35.56629180908203, shots: 1000.
[ADD] Process 24 added to the queue at time 36.06146168708801, shots: 1000.
[MAPPING] Batch [0, 1, 2, 3, 4, 5, 6, 7, 8, 9, 10, 11, 12, 13, 14] allocated data qubit mapping with intro_cost: 0.010160603080957063, helper_cost: 0.06349206349206349, inter_cost: 49.995121357184686, compact_cost: 0.11394473838918277, path_cost: 0.013955071477195371.
[UTILITY] New batch has utility 0.8646616541353384.
[PROCESS COUNT] New batch has 15 processes.
[SHARING RATIO] New batch has helper qubit sharing ratio 0.3695652173913043.
[ADD] Process 25 added to the queue at time 43.9155809879303, shots: 1000.
[HARDWARE RESULT] {8: {'0000000000': 375, '0010000000': 317, '0110000000': 36, '0001000000': 12, '0100000000': 40, '0010000100': 17, '0001000100': 1, '0010001000': 14, '1010000000': 14, '0100100010': 1, '0000000100': 22, '0010100000': 14, '1000000000': 18, '0000001000': 16, '0000010100': 2, '0000100010': 1, '0000000010': 6, '0001000010': 1, '0011000000': 14, '0000010000': 7, '1110000000': 1, '0010000001': 7, '0000100000': 17, '1000000010': 1, '0000000110': 3, '0100100000': 1, '0010010100': 1, '0100001000': 3, '0010101000': 2, '1001000000': 2, '0100001010': 1, '1100100000': 1, '1100000000': 1, '0010010000': 3, '0010000010': 7, '0001100000': 1, '0110000010': 1, '0010001100': 1, '0111000000': 1, '0110100000': 1, '1100000100': 1, '1000100000': 1, '0011001000': 3, '1010001000': 1, '0010100010': 1, '1010100100': 1, '0001010000': 1, '0110001000': 1, '0101000000': 1, '0110000100': 1, '0000000001': 1, '0000100100': 1, '0011000010': 1, '0100000100': 1}, 10: {'0000010000': 50, '1000000000': 192, '1011000000': 15, '1001000000': 158, '0001010000': 49, '1000010000': 107, '0000000000': 74, '1000000100': 6, '0001000010': 5, '0010010000': 1, '1010000000': 10, '1001010000': 119, '1001010010': 4, '1011010000': 10, '0001000000': 64, '0000010010': 2, '1100010000': 5, '0000000001': 3, '1010010000': 6, '1001001000': 4, '0001100000': 2, '1000110000': 6, '0001000001': 2, '1001100000': 5, '1100000000': 6, '0010000000': 6, '1101000010': 1, '1001000010': 4, '1001010100': 1, '0011000000': 5, '0101010000': 3, '0011010000': 3, '0000100000': 1, '1000001000': 7, '0000000010': 4, '1100000010': 1, '0000110000': 2, '1000100000': 7, '1000010010': 4, '0111010000': 1, '1000000010': 5, '0000011000': 3, '1101000000': 1, '1000010100': 2, '1001011000': 5, '1001000100': 3, '1000010001': 1, '0010100000': 1, '1001101000': 2, '1000011000': 1, '0000001000': 2, '1001110000': 2, '0001001000': 3, '1101010000': 2, '0000010100': 1, '0100000000': 1, '1001000011': 1, '0100011000': 1, '1000000001': 1, '0011010001': 1, '0000010001': 1, '0001100001': 1, '0001011000': 1, '0110010000': 1, '1000100100': 1, '1001010001': 1}, 3: {'00000000': 415, '01000000': 373, '00100001': 2, '00010000': 9, '00001000': 19, '00000001': 19, '11000000': 18, '00100000': 16, '01000001': 15, '00000010': 7, '00000100': 6, '01000100': 1, '01011000': 1, '10000000': 24, '01100000': 19, '01001000': 20, '01000010': 4, '00101000': 2, '01010000': 5, '01100010': 2, '01010100': 1, '10001000': 2, '11000011': 1, '01001001': 1, '00010010': 2, '00100010': 3, '01100001': 1, '00010001': 2, '10000010': 1, '00001100': 1, '00000011': 2, '10000001': 1, '11001000': 1, '10100000': 1, '01101000': 1, '10100010': 1, '11010000': 1}, 6: {'10000000': 210, '11000000': 228, '00000000': 178, '01000100': 8, '01000000': 176, '10010000': 3, '00001000': 16, '10000100': 6, '10101000': 2, '00000100': 5, '01100000': 4, '01000001': 6, '00000010': 6, '00000001': 6, '11001000': 23, '01001000': 19, '10001100': 1, '10001000': 25, '01001001': 3, '00100000': 2, '10100000': 6, '11000010': 5, '11000100': 12, '10000001': 3, '00100100': 2, '01000010': 4, '01010000': 2, '00101101': 1, '11000001': 8, '00101001': 2, '11010000': 6, '10000101': 1, '10001010': 1, '10000010': 5, '01101000': 3, '11100000': 3, '11000101': 1, '11101000': 1, '00001001': 1, '10101100': 1, '01001100': 1, '11001010': 2, '00000101': 1, '00101000': 1}, 7: {'01000001': 26, '01001000': 38, '10010000': 8, '01000000': 350, '00001000': 46, '00000000': 361, '01011000': 4, '11010000': 8, '10000000': 14, '00010000': 20, '11001000': 1, '00100000': 10, '00001100': 2, '00000001': 27, '01000100': 6, '00000100': 8, '00000010': 9, '10000100': 1, '11000000': 13, '01100000': 5, '01001010': 2, '00001010': 2, '01000010': 7, '01001001': 1, '10011000': 4, '11000010': 1, '00010010': 1, '10000001': 2, '01010000': 7, '10000010': 1, '00101000': 1, '10001000': 1, '11000001': 1, '11011000': 1, '11010010': 1, '00010001': 1, '00001001': 3, '11010001': 1, '01100001': 1, '00011000': 2, '10010001': 2}, 0: {'00000': 792, '10000': 100, '00100': 20, '01000': 24, '00110': 10, '00001': 25, '00010': 15, '10100': 3, '00011': 2, '11000': 3, '01010': 1, '01100': 1, '10001': 1, '01110': 1, '10110': 1, '10010': 1}, 1: {'000000': 843, '100000': 37, '000001': 46, '010000': 12, '000100': 33, '100001': 3, '001000': 11, '000101': 3, '000010': 6, '010010': 1, '100100': 1, '010001': 2, '100101': 1, '001001': 1}, 2: {'10000': 600, '00000': 229, '00010': 17, '11000': 52, '10010': 29, '10100': 23, '01000': 24, '11010': 7, '00110': 1, '10001': 8, '10011': 1, '01100': 1, '00001': 1, '11100': 2, '00100': 4, '10110': 1}, 4: {'010000000': 651, '011000000': 60, '010000001': 14, '010000010': 44, '010000100': 13, '000000000': 114, '110000000': 15, '010001000': 17, '000000010': 9, '010010000': 1, '100000000': 2, '000100000': 1, '001000000': 11, '011000010': 8, '000000001': 2, '010001100': 1, '110001000': 1, '000000100': 2, '000001001': 1, '111000000': 4, '111000010': 1, '000010000': 1, '110100000': 1, '001000100': 1, '000001000': 3, '011100000': 1, '010100000': 5, '010000110': 2, '011001000': 1, '100001000': 2, '111000001': 1, '010000011': 2, '010001010': 2, '001001000': 1, '011000001': 1, '011000100': 2, '010100010': 1, '010000101': 1}, 5: {'00000': 441, '10000': 473, '01000': 7, '11000': 10, '00010': 14, '00110': 6, '10010': 14, '10110': 10, '10100': 11, '00100': 12, '00001': 2}, 9: {'010000000': 719, '010000100': 17, '110000000': 15, '010001000': 49, '011000000': 74, '000000000': 82, '010000010': 3, '010000001': 9, '011000001': 2, '010100000': 7, '000001000': 5, '001000000': 6, '010001001': 2, '111000000': 3, '011100000': 1, '011001000': 1, '000000100': 1, '010010000': 2, '011000010': 1, '011000100': 1}, 11: {'00100': 37, '00010': 35, '00000': 859, '00001': 39, '01000': 14, '00101': 4, '00011': 4, '10000': 3, '10001': 1, '00110': 3, '10010': 1}, 12: {'00000': 862, '10000': 57, '00010': 28, '10001': 3, '00001': 16, '00100': 19, '10100': 1, '01000': 9, '00110': 3, '10010': 2}, 13: {'000100': 672, '000000': 40, '000101': 50, '001100': 34, '000110': 18, '010100': 83, '010000': 9, '100100': 51, '001101': 4, '000001': 4, '110100': 5, '001000': 4, '000111': 3, '011100': 2, '100000': 4, '010101': 6, '001110': 2, '100101': 5, '101100': 3, '010110': 1}, 14: {'000000': 684, '010000': 141, '100000': 86, '000010': 24, '001000': 24, '110000': 15, '000100': 8, '011000': 2, '010010': 6, '000001': 4, '101000': 3, '000110': 1, '010100': 1, '001010': 1}}
[PROCESS FINISH] Process 0 finished all shots at time 54.687926054000854.
[PROCESS FIDELITY] Process 0 fidelity: 0.792
[PROCESS WAITING TIME] Process 0 waiting time: 52.98557257652283 seconds
[PROCESS FINISH] Process 1 finished all shots at time 54.687926054000854.
[PROCESS FIDELITY] Process 1 fidelity: 0.843
[PROCESS WAITING TIME] Process 1 waiting time: 50.72884678840637 seconds
[PROCESS FINISH] Process 2 finished all shots at time 54.687926054000854.
[PROCESS FIDELITY] Process 2 fidelity: 0.829
[PROCESS WAITING TIME] Process 2 waiting time: 50.306910276412964 seconds
[PROCESS FINISH] Process 3 finished all shots at time 54.687926054000854.
[PROCESS FIDELITY] Process 3 fidelity: 0.788
[PROCESS WAITING TIME] Process 3 waiting time: 48.42350172996521 seconds
[PROCESS FINISH] Process 4 finished all shots at time 54.687926054000854.
[PROCESS FIDELITY] Process 4 fidelity: 0.7070000000000001
[PROCESS WAITING TIME] Process 4 waiting time: 48.270843744277954 seconds
[PROCESS FINISH] Process 5 finished all shots at time 54.687926054000854.
[PROCESS FIDELITY] Process 5 fidelity: 0.714
[PROCESS WAITING TIME] Process 5 waiting time: 48.21605610847473 seconds
[PROCESS FINISH] Process 6 finished all shots at time 54.687926054000854.
[PROCESS FIDELITY] Process 6 fidelity: 0.35400000000000054
[PROCESS WAITING TIME] Process 6 waiting time: 47.80412983894348 seconds
[PROCESS FINISH] Process 7 finished all shots at time 54.687926054000854.
[PROCESS FIDELITY] Process 7 fidelity: 0.711
[PROCESS WAITING TIME] Process 7 waiting time: 46.267149448394775 seconds
[PROCESS FINISH] Process 8 finished all shots at time 54.692991971969604.
[PROCESS FIDELITY] Process 8 fidelity: 0.692
[PROCESS WAITING TIME] Process 8 waiting time: 45.90170073509216 seconds
[PROCESS FINISH] Process 9 finished all shots at time 54.692991971969604.
[PROCESS FIDELITY] Process 9 fidelity: 0.7749999999999999
[PROCESS WAITING TIME] Process 9 waiting time: 43.88656973838806 seconds
[PROCESS FINISH] Process 10 finished all shots at time 54.692991971969604.
[PROCESS FIDELITY] Process 10 fidelity: 0.4880000000000002
[PROCESS WAITING TIME] Process 10 waiting time: 43.47022485733032 seconds
[PROCESS FINISH] Process 11 finished all shots at time 54.692991971969604.
[PROCESS FIDELITY] Process 11 fidelity: 0.859
[PROCESS WAITING TIME] Process 11 waiting time: 42.92523980140686 seconds
[PROCESS FINISH] Process 12 finished all shots at time 54.692991971969604.
[PROCESS FIDELITY] Process 12 fidelity: 0.862
[PROCESS WAITING TIME] Process 12 waiting time: 40.553279399871826 seconds
[PROCESS FINISH] Process 13 finished all shots at time 54.69527339935303.
[PROCESS FIDELITY] Process 13 fidelity: 0.6719999999999999
[PROCESS WAITING TIME] Process 13 waiting time: 38.55830955505371 seconds
[PROCESS FINISH] Process 14 finished all shots at time 54.69527339935303.
[PROCESS FIDELITY] Process 14 fidelity: 0.6839999999999999
[PROCESS WAITING TIME] Process 14 waiting time: 38.01418113708496 seconds
[BATCH] Process batch with [15, 16, 17, 18, 19, 20, 21, 22, 23, 24, 25] selected with min shots 1000.
[MAPPING] Batch [15, 16, 17, 18, 19, 20, 21, 22, 23, 24, 25] allocated data qubit mapping with intro_cost: 0.008900373241458513, helper_cost: 0.09490740740740741, inter_cost: 27.253927101704885, compact_cost: 0.09377906044572712, path_cost: 0.007155635062611807.
[UTILITY] New batch has utility 0.6015037593984962.
[PROCESS COUNT] New batch has 11 processes.
[SHARING RATIO] New batch has helper qubit sharing ratio 0.17333333333333334.
[HARDWARE RESULT] {17: {'00000001': 265, '01000000': 130, '00000000': 117, '01000001': 261, '10000001': 32, '10100001': 2, '11000000': 18, '01010001': 8, '00010000': 7, '10000000': 14, '11000001': 30, '00001001': 24, '01001001': 23, '01101010': 1, '10001000': 3, '11001001': 7, '01101001': 1, '01000101': 3, '00011001': 1, '00010001': 5, '00100001': 4, '01100001': 2, '01001000': 7, '01010000': 3, '11001000': 1, '10010000': 1, '00000101': 3, '00001000': 9, '10010001': 1, '10000101': 1, '10001100': 1, '01100000': 4, '01000011': 2, '01000010': 1, '00001101': 1, '00000010': 1, '00100000': 1, '10001001': 2, '00010101': 1, '11000101': 1, '10000011': 1}, 20: {'1011000': 250, '1001000': 285, '0011000': 168, '0001000': 180, '1111000': 4, '1011001': 15, '1001010': 4, '0101000': 3, '1000000': 8, '0001010': 3, '1001001': 13, '0111000': 6, '1010000': 6, '0011001': 14, '0000001': 1, '1011100': 4, '1101000': 7, '0001001': 10, '0011100': 3, '0001100': 2, '1011010': 3, '1010001': 1, '1111001': 1, '0011010': 1, '0000000': 3, '0010000': 2, '1001100': 1, '0101001': 1, '1101001': 1}, 25: {'0001000': 419, '1011000': 111, '0010000': 1, '1001000': 277, '1011010': 5, '0011000': 51, '0001010': 17, '1001001': 15, '0001001': 26, '0011010': 5, '1001100': 8, '1011001': 7, '0001100': 11, '1011100': 6, '0011100': 2, '1010000': 3, '0101000': 1, '1001110': 2, '1001010': 14, '0000000': 6, '1001101': 1, '1000000': 6, '0011001': 3, '0001110': 1, '1011011': 1, '0111000': 1}, 15: {'000000': 920, '010000': 23, '000001': 6, '110000': 1, '000100': 26, '100000': 10, '001000': 5, '100100': 1, '010100': 3, '000010': 4, '001001': 1}, 16: {'000100': 933, '010100': 19, '001100': 17, '000110': 14, '000000': 11, '000101': 4, '000001': 1, '100100': 1}, 18: {'010000000': 633, '011000000': 17, '010100000': 99, '000000100': 3, '000001000': 7, '000000000': 142, '110001000': 7, '010010000': 6, '010001000': 21, '000100000': 16, '010000001': 5, '110010000': 1, '110011000': 1, '000010000': 3, '110000000': 6, '010000100': 9, '001000000': 2, '110101000': 3, '100101010': 1, '010000010': 1, '001010000': 1, '010100100': 2, '001100000': 1, '111001000': 1, '010100010': 1, '100000000': 1, '000000001': 1, '100001000': 2, '010110000': 1, '011100000': 1, '010100001': 2, '110001001': 1, '000000010': 1, '000101000': 1}, 19: {'000100': 913, '001100': 27, '000000': 15, '010000': 1, '010100': 16, '100100': 11, '001000': 1, '000101': 7, '011100': 1, '000110': 3, '001110': 2, '101100': 2, '001101': 1}, 21: {'00000': 276, '10000': 693, '00010': 3, '11000': 10, '10110': 6, '10010': 3, '10100': 2, '01000': 3, '10001': 3, '00100': 1}, 22: {'010000000': 774, '010000001': 31, '010000010': 3, '011000000': 8, '000000001': 6, '000000000': 124, '010011000': 1, '110000000': 10, '010001000': 18, '010000100': 3, '110000101': 1, '010100000': 8, '010010000': 3, '010000101': 1, '001000000': 1, '000001001': 1, '000001000': 1, '011001000': 1, '010010001': 1, '010100100': 1, '011000001': 1, '010101000': 1, '100000000': 1}, 23: {'10000': 682, '10100': 42, '00000': 219, '00100': 15, '11000': 10, '10010': 17, '00101': 1, '01000': 4, '01010': 1, '00001': 1, '10110': 1, '00010': 4, '00110': 2, '10001': 1}, 24: {'00000': 250, '10000': 657, '11000': 43, '10010': 5, '10100': 8, '01000': 21, '00100': 4, '00010': 3, '10001': 6, '00001': 1, '11100': 1, '01100': 1}}
[PROCESS FINISH] Process 15 finished all shots at time 111.26459789276123.
[PROCESS FIDELITY] Process 15 fidelity: 0.92
[PROCESS WAITING TIME] Process 15 waiting time: 89.32829141616821 seconds
[PROCESS FINISH] Process 16 finished all shots at time 111.2651104927063.
[PROCESS FIDELITY] Process 16 fidelity: 0.933
[PROCESS WAITING TIME] Process 16 waiting time: 86.93704271316528 seconds
[PROCESS FINISH] Process 17 finished all shots at time 111.2651104927063.
[PROCESS FIDELITY] Process 17 fidelity: 0.24700000000000077
[PROCESS WAITING TIME] Process 17 waiting time: 86.74124646186829 seconds
[PROCESS FINISH] Process 18 finished all shots at time 111.26562786102295.
[PROCESS FIDELITY] Process 18 fidelity: 0.6890000000000001
[PROCESS WAITING TIME] Process 18 waiting time: 86.44583678245544 seconds
[PROCESS FINISH] Process 19 finished all shots at time 111.26562786102295.
[PROCESS FIDELITY] Process 19 fidelity: 0.913
[PROCESS WAITING TIME] Process 19 waiting time: 84.57497644424438 seconds
[PROCESS FINISH] Process 20 finished all shots at time 111.2661440372467.
[PROCESS FIDELITY] Process 20 fidelity: 0.46499999999999997
[PROCESS WAITING TIME] Process 20 waiting time: 79.81475567817688 seconds
[PROCESS FINISH] Process 21 finished all shots at time 111.2661440372467.
[PROCESS FIDELITY] Process 21 fidelity: 0.9339999999999999
[PROCESS WAITING TIME] Process 21 waiting time: 77.92852997779846 seconds
[PROCESS FINISH] Process 22 finished all shots at time 111.26666593551636.
[PROCESS FIDELITY] Process 22 fidelity: 0.8300000000000001
[PROCESS WAITING TIME] Process 22 waiting time: 75.87058520317078 seconds
[PROCESS FINISH] Process 23 finished all shots at time 111.26718592643738.
[PROCESS FIDELITY] Process 23 fidelity: 0.901
[PROCESS WAITING TIME] Process 23 waiting time: 75.70089411735535 seconds
[PROCESS FINISH] Process 24 finished all shots at time 111.26718592643738.
[PROCESS FIDELITY] Process 24 fidelity: 0.898
[PROCESS WAITING TIME] Process 24 waiting time: 75.20572423934937 seconds
[PROCESS FINISH] Process 25 finished all shots at time 111.26718592643738.
[PROCESS FIDELITY] Process 25 fidelity: 0.696
[PROCESS WAITING TIME] Process 25 waiting time: 67.35160493850708 seconds
[STOP] Scheduling stopped at time 112.27907800674438.
------------------Statistics:---------------------------------Total running time: 111.68923926353455
Finished process count: 26
Throughput: 
0.2327887643558223
----------------------Batch statistics-----------------------:
Batch 0: Number of processes: 15, Qubit utilization: 0.8646616541353384
Batch 1: Number of processes: 11, Qubit utilization: 0.6015037593984962
Batch 0: Shared ratio: 0
Batch 1: Shared ratio: 1
Average shared ratio per batch: 0.27144927536231883
Average number of processes per batch: 13.0
Average qubit utility per batch: 0.7330827067669172
----------------------Batch different costs-----------------------:
Batch 0: Intro: 0.010160603080957063, Helper: 0.06349206349206349, Inter: 49.995121357184686, Compact: 0.11394473838918277, Path: 0.013955071477195371
Process number: 15, Average fidelity: 0.7180000000000002
Batch 1: Intro: 0.008900373241458513, Helper: 0.09490740740740741, Inter: 27.253927101704885, Compact: 0.09377906044572712, Path: 0.007155635062611807
Process number: 11, Average fidelity: 0.3240769230769231
Average Intro cost per batch: 0.5
Average Helper cost per batch: 0.5
Average Inter cost per batch: 0.5
Average Compact cost per batch: 0.5
Average Path cost per batch: 0.5
----------------------Process waiting times-----------------------:
Process 0: 52.98557257652283
Process 1: 50.72884678840637
Process 2: 50.306910276412964
Process 3: 48.42350172996521
Process 4: 48.270843744277954
Process 5: 48.21605610847473
Process 6: 47.80412983894348
Process 7: 46.267149448394775
Process 8: 45.90170073509216
Process 9: 43.88656973838806
Process 10: 43.47022485733032
Process 11: 42.92523980140686
Process 12: 40.553279399871826
Process 13: 38.55830955505371
Process 14: 38.01418113708496
Process 15: 89.32829141616821
Process 16: 86.93704271316528
Process 17: 86.74124646186829
Process 18: 86.44583678245544
Process 19: 84.57497644424438
Process 20: 79.81475567817688
Process 21: 77.92852997779846
Process 22: 75.87058520317078
Process 23: 75.70089411735535
Process 24: 75.20572423934937
Process 25: 67.35160493850708
Average waiting time across all processes: 60.4696924503033
----------------------Process fidelities-----------------------:
Process 0: 0.792
Process 1: 0.843
Process 2: 0.829
Process 3: 0.788
Process 4: 0.7070000000000001
Process 5: 0.714
Process 6: 0.35400000000000054
Process 7: 0.711
Process 8: 0.692
Process 9: 0.7749999999999999
Process 10: 0.4880000000000002
Process 11: 0.859
Process 12: 0.862
Process 13: 0.6719999999999999
Process 14: 0.6839999999999999
Process 15: 0.92
Process 16: 0.933
Process 17: 0.24700000000000077
Process 18: 0.6890000000000001
Process 19: 0.913
Process 20: 0.46499999999999997
Process 21: 0.9339999999999999
Process 22: 0.8300000000000001
Process 23: 0.901
Process 24: 0.898
Process 25: 0.696
Average fidelity across all processes: 0.7383076923076926
