----------------------Log:---------------------------------
[ADD] Process 0 added to the queue at time 1.7026519775390625, shots: 1000.
[ADD] Process 1 added to the queue at time 3.958852529525757, shots: 1000.
[ADD] Process 2 added to the queue at time 4.381705284118652, shots: 1000.
[ADD] Process 3 added to the queue at time 6.264811277389526, shots: 1000.
[ADD] Process 4 added to the queue at time 6.420032501220703, shots: 1000.
[ADD] Process 5 added to the queue at time 6.474687576293945, shots: 1000.
[ADD] Process 6 added to the queue at time 6.888006925582886, shots: 1000.
[ADD] Process 7 added to the queue at time 8.425018310546875, shots: 1000.
[BATCH] Process batch with [0, 1, 2, 3, 4, 5, 6, 7] selected with min shots 1000.
[ADD] Process 8 added to the queue at time 8.800280570983887, shots: 1000.
[ADD] Process 9 added to the queue at time 10.814503908157349, shots: 1000.
[ADD] Process 10 added to the queue at time 11.056396484375, shots: 1000.
[ADD] Process 11 added to the queue at time 15.737944602966309, shots: 1000.
[ADD] Process 12 added to the queue at time 17.227519035339355, shots: 1000.
[ADD] Process 13 added to the queue at time 19.12835693359375, shots: 1000.
[ADD] Process 14 added to the queue at time 19.927884340286255, shots: 1000.
[ADD] Process 15 added to the queue at time 19.935842990875244, shots: 1000.
[ADD] Process 16 added to the queue at time 22.55201816558838, shots: 1000.
[ADD] Process 17 added to the queue at time 24.813694953918457, shots: 1000.
[ADD] Process 18 added to the queue at time 25.327266693115234, shots: 1000.
[MAPPING] Batch [0, 1, 2, 3, 4, 5, 6, 7] allocated data qubit mapping with intro_cost: 0.007043368154479266, helper_cost: 0.0, inter_cost: 11.019066515495082, compact_cost: 0.14031994240327572, path_cost: 0.026298487836949377.
[UTILITY] New batch has utility 0.6616541353383458.
[PROCESS COUNT] New batch has 8 processes.
[SHARING RATIO] New batch has helper qubit sharing ratio 0.0.
[BATCH] Process batch with [8, 9, 10, 11, 12, 13, 14, 15, 18] selected with min shots 1000.
[ADD] Process 19 added to the queue at time 29.177088499069214, shots: 1000.
[ADD] Process 20 added to the queue at time 29.41254496574402, shots: 1000.
[ADD] Process 21 added to the queue at time 32.91097402572632, shots: 1000.
[ADD] Process 22 added to the queue at time 34.53244924545288, shots: 1000.
[ADD] Process 23 added to the queue at time 35.738906383514404, shots: 1000.
[ADD] Process 24 added to the queue at time 36.87568545341492, shots: 1000.
[ADD] Process 25 added to the queue at time 38.379433155059814, shots: 1000.
[ADD] Process 26 added to the queue at time 38.78281021118164, shots: 1000.
[HARDWARE RESULT] {3: {'10000000': 33, '00000010': 124, '01000100': 12, '01000000': 231, '01001010': 7, '00000000': 244, '01000010': 84, '01101010': 1, '01001000': 26, '00101000': 4, '01101000': 7, '00001000': 23, '00000110': 9, '10001000': 4, '00010000': 13, '01000001': 7, '00000100': 20, '11000000': 19, '11001000': 1, '01010000': 5, '00010010': 4, '00001010': 17, '00100000': 4, '10010010': 3, '11000010': 14, '00010100': 3, '01111000': 1, '10000110': 2, '10100000': 2, '00100110': 1, '00000001': 6, '01001011': 1, '01100010': 2, '01000110': 10, '10000010': 9, '11001001': 1, '01100000': 7, '10110000': 1, '01010010': 5, '10001010': 2, '00101010': 5, '10000100': 1, '00101100': 1, '00001100': 1, '10010000': 1, '00000011': 3, '01011010': 1, '00100010': 2, '11010100': 1, '11010010': 1, '10001011': 1, '00001011': 1, '11000111': 1, '11001010': 1, '11101000': 1, '10001001': 1, '11000100': 1, '11101010': 1, '01010100': 1, '00001110': 1, '00001001': 2, '01011000': 1, '10000001': 1}, 6: {'10000000': 85, '00000000': 310, '01000000': 318, '00001000': 40, '01001000': 51, '01000001': 21, '00000001': 20, '10001000': 14, '11000000': 74, '00010000': 7, '01001010': 1, '11100000': 1, '00011000': 2, '01010100': 1, '00100000': 5, '10000001': 6, '01010000': 4, '11000001': 3, '10100000': 2, '11001000': 10, '11001001': 1, '01001001': 1, '01011000': 4, '00001010': 1, '01100000': 4, '11011000': 1, '11010000': 1, '00101001': 1, '01000011': 1, '00000010': 1, '00001001': 2, '11011010': 1, '01000010': 2, '00111000': 1, '01101000': 1, '10001001': 1, '10010000': 1}, 7: {'00000000': 356, '01000000': 365, '01000100': 12, '00000010': 29, '00000001': 27, '01000001': 32, '00001000': 11, '01001000': 19, '00000100': 10, '01001010': 1, '01000010': 39, '01100010': 2, '01100001': 2, '00100000': 8, '01100000': 18, '10000100': 4, '11001000': 4, '10000000': 9, '00000101': 1, '00100010': 1, '00001101': 2, '01000101': 1, '00100111': 1, '01001001': 3, '11001100': 1, '11001101': 1, '10001000': 5, '00001100': 2, '01001110': 1, '01001101': 2, '11000000': 5, '00000011': 3, '10100000': 2, '00000111': 1, '00001001': 2, '10000010': 1, '01000011': 1, '01001100': 2, '11000100': 2, '11000010': 2, '11001010': 1, '01010000': 1, '01001111': 1, '00101001': 1, '10001100': 1, '10001001': 2, '01101000': 1, '00001010': 1, '00010001': 1}, 0: {'00000': 979, '10000': 7, '00010': 8, '01000': 6}, 1: {'000000': 968, '000100': 3, '100000': 7, '000010': 4, '000001': 2, '010000': 1, '001000': 13, '101000': 2}, 2: {'00000': 248, '10000': 731, '11001': 1, '10010': 5, '10100': 8, '01000': 2, '10001': 2, '00010': 1, '00100': 1, '00110': 1}, 4: {'010000100': 17, '010100000': 7, '010000000': 411, '000000000': 441, '000000001': 10, '010000001': 5, '110000000': 3, '010001000': 20, '011000000': 8, '000000010': 3, '000001000': 22, '000101000': 1, '000000100': 7, '110100000': 1, '010001100': 4, '001000000': 12, '100000000': 6, '111000000': 1, '000100000': 8, '000010000': 1, '011010000': 1, '001000100': 1, '010010000': 3, '010101000': 1, '000001100': 4, '110000001': 1, '001000001': 1}, 5: {'10000': 648, '00000': 327, '10010': 7, '11000': 4, '00010': 2, '01000': 1, '10100': 5, '10001': 3, '00100': 1, '00001': 1, '11100': 1}}
[PROCESS FINISH] Process 0 finished all shots at time 38.799312114715576.
[PROCESS FIDELITY] Process 0 fidelity: 0.979
[PROCESS WAITING TIME] Process 0 waiting time: 37.096660137176514 seconds
[PROCESS FINISH] Process 1 finished all shots at time 38.799312114715576.
[PROCESS FIDELITY] Process 1 fidelity: 0.968
[PROCESS WAITING TIME] Process 1 waiting time: 34.84045958518982 seconds
[PROCESS FINISH] Process 2 finished all shots at time 38.81033515930176.
[PROCESS FIDELITY] Process 2 fidelity: 0.972
[PROCESS WAITING TIME] Process 2 waiting time: 34.428629875183105 seconds
[PROCESS FINISH] Process 3 finished all shots at time 38.85104298591614.
[PROCESS FIDELITY] Process 3 fidelity: 0.4750000000000002
[PROCESS WAITING TIME] Process 3 waiting time: 32.58623170852661 seconds
[PROCESS FINISH] Process 4 finished all shots at time 38.87120771408081.
[PROCESS FIDELITY] Process 4 fidelity: 0.46699999999999997
[PROCESS WAITING TIME] Process 4 waiting time: 32.45117521286011 seconds
[PROCESS FINISH] Process 5 finished all shots at time 38.8799307346344.
[PROCESS FIDELITY] Process 5 fidelity: 0.889
[PROCESS WAITING TIME] Process 5 waiting time: 32.405243158340454 seconds
[PROCESS FINISH] Process 6 finished all shots at time 38.88704299926758.
[PROCESS FIDELITY] Process 6 fidelity: 0.6280000000000001
[PROCESS WAITING TIME] Process 6 waiting time: 31.999036073684692 seconds
[PROCESS FINISH] Process 7 finished all shots at time 38.89231538772583.
[PROCESS FIDELITY] Process 7 fidelity: 0.721
[PROCESS WAITING TIME] Process 7 waiting time: 30.467297077178955 seconds
[MAPPING] Batch [8, 9, 10, 11, 12, 13, 14, 15, 18] allocated data qubit mapping with intro_cost: 0.004748338081671415, helper_cost: 0.0, inter_cost: 14.877074420908516, compact_cost: 0.1427958885838334, path_cost: 0.016703648915187375.
[UTILITY] New batch has utility 0.7969924812030075.
[PROCESS COUNT] New batch has 9 processes.
[SHARING RATIO] New batch has helper qubit sharing ratio 0.0.
[BATCH] Process batch with [16, 17, 19, 20, 21, 22, 23, 24] selected with min shots 1000.
[ADD] Process 27 added to the queue at time 41.698132276535034, shots: 1000.
[HARDWARE RESULT] {8: {'0000000000': 478, '0010000100': 13, '0010000000': 404, '0100000000': 4, '0000100000': 6, '0010000010': 20, '0010100000': 7, '0000000010': 21, '0010010000': 3, '0000010000': 4, '1000000000': 8, '0000000100': 20, '0110000000': 2, '0000110000': 1, '0011000000': 1, '0010000110': 1, '1010000000': 5, '0000100100': 1, '0000000001': 1}, 13: {'0010010000': 6, '0000000000': 413, '1000000000': 9, '0010000000': 427, '0011000000': 16, '0000000001': 11, '0000100000': 13, '0010000010': 6, '1010000000': 4, '0001000000': 11, '0100000000': 23, '0110000000': 19, '0010000001': 8, '0000001000': 3, '0010100000': 12, '0010001000': 3, '0000010000': 9, '1010100000': 1, '0110100000': 2, '0000000010': 2, '0001010000': 1, '0100000001': 1}, 9: {'1001001': 173, '0001011': 20, '1001000': 183, '1001100': 7, '1001011': 17, '1111111': 1, '0001000': 250, '0001001': 191, '0001100': 10, '1001010': 22, '0001010': 14, '0011001': 5, '0000101': 1, '0011011': 4, '1011011': 1, '1011010': 4, '0000000': 8, '1101000': 7, '1000001': 6, '1001110': 1, '1101001': 6, '1000000': 5, '1011000': 4, '1001101': 1, '0000001': 8, '0101001': 6, '0101000': 8, '0011100': 2, '0001101': 8, '1011001': 4, '0011000': 7, '0011010': 6, '1011110': 1, '1011100': 1, '1011111': 1, '0000011': 1, '0101100': 1, '0011101': 1, '0001110': 1, '0101011': 1, '0101010': 1, '0101101': 1}, 14: {'00000000': 401, '01000000': 336, '01001000': 59, '00000010': 9, '00001000': 60, '01100000': 36, '10000000': 10, '01000010': 13, '01101000': 8, '00100000': 27, '00100100': 1, '11000000': 11, '01000100': 3, '10001000': 1, '00101000': 9, '01001010': 2, '11100000': 2, '01110000': 1, '00100010': 1, '00000100': 4, '11000010': 2, '10000010': 2, '10100010': 1, '00010000': 1}, 10: {'000100': 928, '010100': 26, '100100': 17, '000000': 21, '001100': 4, '000110': 1, '110100': 2, '001000': 1}, 11: {'00000': 779, '00010': 71, '00100': 27, '10010': 4, '00001': 28, '01010': 4, '00110': 3, '01000': 20, '10000': 47, '10001': 1, '11000': 5, '00101': 5, '01001': 2, '00011': 2, '01100': 1, '10100': 1}, 12: {'000100': 926, '000000': 21, '100100': 28, '010100': 10, '000101': 3, '000110': 5, '000010': 2, '001100': 5}, 15: {'10000': 729, '00000': 235, '11000': 26, '01000': 4, '10100': 2, '00001': 1, '00010': 1, '00100': 1, '10001': 1}, 18: {'10000': 488, '00000': 449, '00010': 20, '00001': 3, '10010': 21, '11000': 6, '01010': 1, '01000': 4, '10001': 4, '10100': 2, '00100': 2}}
[PROCESS FINISH] Process 8 finished all shots at time 50.3686785697937.
[PROCESS FIDELITY] Process 8 fidelity: 0.882
[PROCESS WAITING TIME] Process 8 waiting time: 41.568397998809814 seconds
[PROCESS FINISH] Process 9 finished all shots at time 50.3686785697937.
[PROCESS FIDELITY] Process 9 fidelity: 0.43299999999999983
[PROCESS WAITING TIME] Process 9 waiting time: 39.55417466163635 seconds
[PROCESS FINISH] Process 10 finished all shots at time 50.373695611953735.
[PROCESS FIDELITY] Process 10 fidelity: 0.928
[PROCESS WAITING TIME] Process 10 waiting time: 39.317299127578735 seconds
[PROCESS FINISH] Process 11 finished all shots at time 50.373695611953735.
[PROCESS FIDELITY] Process 11 fidelity: 0.779
[PROCESS WAITING TIME] Process 11 waiting time: 34.63575100898743 seconds
[PROCESS FINISH] Process 12 finished all shots at time 50.373695611953735.
[PROCESS FIDELITY] Process 12 fidelity: 0.926
[PROCESS WAITING TIME] Process 12 waiting time: 33.14617657661438 seconds
[PROCESS FINISH] Process 13 finished all shots at time 50.378703594207764.
[PROCESS FIDELITY] Process 13 fidelity: 0.84
[PROCESS WAITING TIME] Process 13 waiting time: 31.250346660614014 seconds
[PROCESS FINISH] Process 14 finished all shots at time 50.37980556488037.
[PROCESS FIDELITY] Process 14 fidelity: 0.7370000000000001
[PROCESS WAITING TIME] Process 14 waiting time: 30.451921224594116 seconds
[PROCESS FINISH] Process 15 finished all shots at time 50.38144516944885.
[PROCESS FIDELITY] Process 15 fidelity: 0.964
[PROCESS WAITING TIME] Process 15 waiting time: 30.44560217857361 seconds
[PROCESS FINISH] Process 18 finished all shots at time 50.382473945617676.
[PROCESS FIDELITY] Process 18 fidelity: 0.44900000000000007
[PROCESS WAITING TIME] Process 18 waiting time: 25.05520725250244 seconds
[MAPPING] Batch [16, 17, 19, 20, 21, 22, 23, 24] allocated data qubit mapping with intro_cost: 0.004993141289437585, helper_cost: 0.0, inter_cost: 11.693654391676784, compact_cost: 0.17122163647898941, path_cost: 0.06011396011396011.
[UTILITY] New batch has utility 0.7894736842105263.
[PROCESS COUNT] New batch has 8 processes.
[SHARING RATIO] New batch has helper qubit sharing ratio 0.0.
[HARDWARE RESULT] {20: {'0010000000': 402, '0000000000': 392, '0010100000': 4, '0011000000': 13, '0110000000': 7, '0000010000': 7, '0010000001': 25, '0001000000': 10, '0000000001': 25, '0010010010': 1, '0010001001': 1, '1010000000': 3, '0000001000': 9, '0010001000': 14, '0000000010': 5, '0000010001': 5, '0010010001': 4, '0010010000': 10, '0000001100': 5, '0100000000': 6, '0000000100': 7, '0010000101': 2, '0011000100': 3, '0001000100': 3, '1111010101': 1, '1000000000': 3, '0011000001': 1, '0010000010': 7, '0110001000': 1, '0011010000': 2, '0000100000': 6, '0011001000': 1, '1100000000': 2, '0111000001': 1, '0000001010': 1, '0010000100': 2, '0000001001': 1, '0100001000': 1, '0001001101': 1, '1000000001': 1, '1001000000': 1, '1001010000': 1, '1010000001': 1, '1010010000': 2}, 21: {'1001000000': 230, '1000000000': 253, '0000000000': 101, '1001010000': 40, '1000010000': 54, '0001000000': 82, '0001011000': 3, '1000010010': 7, '1010000000': 16, '1000001000': 32, '1011010010': 1, '1001001000': 17, '1100000000': 15, '0000010000': 13, '1011010000': 6, '1001000010': 7, '0001010000': 12, '1100010000': 2, '1011000000': 8, '0010000000': 2, '1000011000': 5, '1011001000': 2, '0001000010': 2, '1001001010': 1, '1000000010': 5, '0000101000': 1, '1001011010': 1, '0000001000': 8, '0001001000': 8, '0000000010': 3, '0000010010': 1, '1101000000': 9, '0100000000': 3, '0101000000': 4, '1101010000': 1, '1101001010': 1, '0011010000': 2, '0101001000': 1, '0100001000': 1, '1001011000': 2, '1000110000': 2, '0001010010': 1, '1100001000': 1, '0001110000': 1, '1001000001': 3, '0000001010': 1, '1001100000': 4, '1001010010': 6, '1000100000': 2, '1010010000': 4, '0011000000': 1, '0000011000': 2, '1000101000': 1, '0000110010': 1, '1100001010': 1, '0000100000': 2, '0001100000': 2, '1010000100': 1, '1001000100': 1, '1000000001': 1}, 23: {'0010000000': 449, '0000000000': 398, '0000100000': 21, '0011000000': 17, '0000000100': 5, '0010100000': 22, '0000000001': 16, '0010001000': 6, '0001000000': 14, '1000000000': 4, '0000001000': 6, '0010010000': 11, '0010000001': 3, '0010000010': 4, '0010000100': 5, '0000100010': 2, '0000100100': 1, '0011100000': 1, '1010000000': 3, '0000010000': 2, '0000101000': 1, '0000000010': 3, '0001000010': 1, '0001000100': 1, '0110000000': 1, '0010100001': 2, '0001100000': 1}, 22: {'00000000': 306, '10100100': 1, '00000100': 23, '01000000': 199, '00000010': 81, '00001010': 16, '10001000': 4, '10000000': 23, '01001010': 10, '01000100': 23, '11000010': 4, '01000010': 45, '00001000': 61, '01001000': 49, '00000001': 10, '00100000': 13, '00001100': 4, '11000000': 15, '01100000': 7, '10100010': 2, '01000001': 7, '00010000': 6, '11001000': 3, '01000110': 4, '10000100': 4, '00000011': 4, '01001001': 2, '00011000': 4, '00011010': 2, '01110000': 1, '10000101': 1, '00010110': 1, '10001011': 2, '00101000': 1, '11000101': 1, '10100000': 1, '10010000': 1, '00001001': 5, '10101001': 1, '10000001': 4, '00101100': 2, '01010000': 3, '01001100': 2, '00000110': 5, '01011000': 3, '00100100': 1, '10000010': 5, '01100010': 5, '11001100': 1, '11000001': 1, '01000011': 4, '00100010': 2, '00001101': 1, '00000101': 1, '00100001': 1, '01010100': 1, '01100100': 1, '01000101': 1, '00001011': 1, '00101010': 1, '10000110': 1, '11000110': 1, '01101000': 1, '11000100': 1, '10000011': 1, '00010010': 1, '10001010': 1}, 16: {'000000': 885, '100000': 37, '010000': 25, '000001': 28, '000010': 1, '001000': 8, '000100': 4, '010001': 2, '100001': 6, '110000': 2, '000101': 1, '001001': 1}, 17: {'010000': 25, '000000': 923, '000100': 9, '010010': 1, '000010': 16, '100000': 17, '110000': 3, '001000': 4, '001010': 1, '011000': 1}, 19: {'00000': 863, '00100': 15, '10001': 11, '10000': 45, '00001': 36, '01000': 10, '11001': 2, '11000': 6, '10100': 8, '00010': 2, '10101': 1, '01100': 1}, 24: {'000100': 563, '001100': 362, '000000': 19, '000110': 3, '001110': 7, '010100': 13, '001000': 11, '101100': 1, '001101': 5, '011100': 6, '000101': 8, '011000': 2}}
[PROCESS FINISH] Process 16 finished all shots at time 61.95511603355408.
[PROCESS FIDELITY] Process 16 fidelity: 0.885
[PROCESS WAITING TIME] Process 16 waiting time: 39.4030978679657 seconds
[PROCESS FINISH] Process 17 finished all shots at time 61.95511603355408.
[PROCESS FIDELITY] Process 17 fidelity: 0.923
[PROCESS WAITING TIME] Process 17 waiting time: 37.14142107963562 seconds
[PROCESS FINISH] Process 19 finished all shots at time 61.95511603355408.
[PROCESS FIDELITY] Process 19 fidelity: 0.863
[PROCESS WAITING TIME] Process 19 waiting time: 32.77802753448486 seconds
[PROCESS FINISH] Process 20 finished all shots at time 61.95511603355408.
[PROCESS FIDELITY] Process 20 fidelity: 0.794
[PROCESS WAITING TIME] Process 20 waiting time: 32.54257106781006 seconds
[PROCESS FINISH] Process 21 finished all shots at time 61.95511603355408.
[PROCESS FIDELITY] Process 21 fidelity: 0.6659999999999999
[PROCESS WAITING TIME] Process 21 waiting time: 29.04414200782776 seconds
[PROCESS FINISH] Process 22 finished all shots at time 61.95511603355408.
[PROCESS FIDELITY] Process 22 fidelity: 0.5049999999999999
[PROCESS WAITING TIME] Process 22 waiting time: 27.422666788101196 seconds
[PROCESS FINISH] Process 23 finished all shots at time 61.95511603355408.
[PROCESS FIDELITY] Process 23 fidelity: 0.847
[PROCESS WAITING TIME] Process 23 waiting time: 26.216209650039673 seconds
[PROCESS FINISH] Process 24 finished all shots at time 61.95511603355408.
[PROCESS FIDELITY] Process 24 fidelity: 0.563
[PROCESS WAITING TIME] Process 24 waiting time: 25.07943058013916 seconds
[BATCH] Process batch with [25, 26, 27] selected with min shots 1000.
[MAPPING] Batch [25, 26, 27] allocated data qubit mapping with intro_cost: 0.0047425474254742545, helper_cost: 0.0, inter_cost: 1.5350529100529107, compact_cost: 0.21944406759221563, path_cost: 0.020403377110694183.
[UTILITY] New batch has utility 0.24060150375939848.
[PROCESS COUNT] New batch has 3 processes.
[SHARING RATIO] New batch has helper qubit sharing ratio 0.0.
[HARDWARE RESULT] {25: {'00000000': 980, '00000010': 2, '00100000': 5, '10000000': 4, '01000000': 4, '00010000': 1, '00001000': 1, '00000100': 3}, 26: {'1001000': 549, '0001000': 416, '1001100': 5, '1101000': 8, '1001001': 1, '1000000': 7, '0001100': 4, '0001001': 1, '0001101': 1, '0000000': 2, '0101000': 4, '1011000': 2}, 27: {'10000': 709, '10010': 12, '00000': 246, '10001': 7, '00100': 4, '11000': 6, '00010': 4, '10100': 6, '00001': 4, '01000': 1, '01100': 1}}
[PROCESS FINISH] Process 25 finished all shots at time 120.06317615509033.
[PROCESS FIDELITY] Process 25 fidelity: 0.98
[PROCESS WAITING TIME] Process 25 waiting time: 81.68374300003052 seconds
[PROCESS FINISH] Process 26 finished all shots at time 120.06317615509033.
[PROCESS FIDELITY] Process 26 fidelity: 0.9604999999999999
[PROCESS WAITING TIME] Process 26 waiting time: 81.28036594390869 seconds
[PROCESS FINISH] Process 27 finished all shots at time 120.06317615509033.
[PROCESS FIDELITY] Process 27 fidelity: 0.95
[PROCESS WAITING TIME] Process 27 waiting time: 78.3650438785553 seconds
[STOP] Scheduling stopped at time 121.07462882995605.
------------------Statistics:---------------------------------Total running time: 120.7045156955719
Finished process count: 28
Throughput: 
0.2319714373455474
----------------------Batch statistics-----------------------:
Batch 0: Number of processes: 8, Qubit utilization: 0.6616541353383458
Batch 1: Number of processes: 9, Qubit utilization: 0.7969924812030075
Batch 2: Number of processes: 8, Qubit utilization: 0.7894736842105263
Batch 3: Number of processes: 3, Qubit utilization: 0.24060150375939848
Batch 0: Shared ratio: 0
Batch 1: Shared ratio: 1
Batch 2: Shared ratio: 2
Batch 3: Shared ratio: 3
Average shared ratio per batch: 0.0
Average number of processes per batch: 7.0
Average qubit utility per batch: 0.6221804511278195
----------------------Batch different costs-----------------------:
Batch 0: Intro: 0.007043368154479266, Helper: 0.0, Inter: 11.019066515495082, Compact: 0.14031994240327572, Path: 0.026298487836949377
Process number: 8, Average fidelity: 0.762375
Batch 1: Intro: 0.004748338081671415, Helper: 0.0, Inter: 14.877074420908516, Compact: 0.1427958885838334, Path: 0.016703648915187375
Process number: 9, Average fidelity: 0.4081176470588236
Batch 2: Intro: 0.004993141289437585, Helper: 0.0, Inter: 11.693654391676784, Compact: 0.17122163647898941, Path: 0.06011396011396011
Process number: 8, Average fidelity: 0.24184
Batch 3: Intro: 0.0047425474254742545, Helper: 0.0, Inter: 1.5350529100529107, Compact: 0.21944406759221563, Path: 0.020403377110694183
Process number: 3, Average fidelity: 0.10323214285714286
Average Intro cost per batch: 1.5
Average Helper cost per batch: 1.5
Average Inter cost per batch: 1.5
Average Compact cost per batch: 1.5
Average Path cost per batch: 1.5
----------------------Process waiting times-----------------------:
Process 0: 37.096660137176514
Process 1: 34.84045958518982
Process 2: 34.428629875183105
Process 3: 32.58623170852661
Process 4: 32.45117521286011
Process 5: 32.405243158340454
Process 6: 31.999036073684692
Process 7: 30.467297077178955
Process 8: 41.568397998809814
Process 9: 39.55417466163635
Process 10: 39.317299127578735
Process 11: 34.63575100898743
Process 12: 33.14617657661438
Process 13: 31.250346660614014
Process 14: 30.451921224594116
Process 15: 30.44560217857361
Process 18: 25.05520725250244
Process 16: 39.4030978679657
Process 17: 37.14142107963562
Process 19: 32.77802753448486
Process 20: 32.54257106781006
Process 21: 29.04414200782776
Process 22: 27.422666788101196
Process 23: 26.216209650039673
Process 24: 25.07943058013916
Process 25: 81.68374300003052
Process 26: 81.28036594390869
Process 27: 78.3650438785553
Average waiting time across all processes: 37.95201174701963
----------------------Process fidelities-----------------------:
Process 0: 0.979
Process 1: 0.968
Process 2: 0.972
Process 3: 0.4750000000000002
Process 4: 0.46699999999999997
Process 5: 0.889
Process 6: 0.6280000000000001
Process 7: 0.721
Process 8: 0.882
Process 9: 0.43299999999999983
Process 10: 0.928
Process 11: 0.779
Process 12: 0.926
Process 13: 0.84
Process 14: 0.7370000000000001
Process 15: 0.964
Process 18: 0.44900000000000007
Process 16: 0.885
Process 17: 0.923
Process 19: 0.863
Process 20: 0.794
Process 21: 0.6659999999999999
Process 22: 0.5049999999999999
Process 23: 0.847
Process 24: 0.563
Process 25: 0.98
Process 26: 0.9604999999999999
Process 27: 0.95
Average fidelity across all processes: 0.784767857142857
