----------------------Log:---------------------------------
[ADD] Process 0 added to the queue at time 1.704310655593872, shots: 1000.
[ADD] Process 1 added to the queue at time 3.960205316543579, shots: 1000.
[ADD] Process 2 added to the queue at time 4.381799697875977, shots: 1000.
[ADD] Process 3 added to the queue at time 6.265453577041626, shots: 1000.
[ADD] Process 4 added to the queue at time 6.417365074157715, shots: 1000.
[ADD] Process 5 added to the queue at time 6.473296165466309, shots: 1000.
[ADD] Process 6 added to the queue at time 6.8860557079315186, shots: 1000.
[ADD] Process 7 added to the queue at time 8.424082279205322, shots: 1000.
[BATCH] Process batch with [0, 1, 2, 3, 4, 5, 6, 7] selected with min shots 1000.
[ADD] Process 8 added to the queue at time 8.798094272613525, shots: 1000.
[ADD] Process 9 added to the queue at time 10.831499814987183, shots: 1000.
[ADD] Process 10 added to the queue at time 11.434033870697021, shots: 1000.
[ADD] Process 11 added to the queue at time 11.636961936950684, shots: 1000.
[ADD] Process 12 added to the queue at time 12.333790302276611, shots: 1000.
[ADD] Process 13 added to the queue at time 13.026183128356934, shots: 1000.
[UTILITY] New batch has utility 0.6616541353383458.
[PROCESS COUNT] New batch has 8 processes.
[SHARING RATIO] New batch has helper qubit sharing ratio 0.0.
[ADD] Process 14 added to the queue at time 17.381170511245728, shots: 1000.
[BATCH] Process batch with [8, 9, 10, 11, 12, 13, 14] selected with min shots 1000.
[ADD] Process 15 added to the queue at time 19.009845733642578, shots: 1000.
[ADD] Process 16 added to the queue at time 20.172901391983032, shots: 1000.
[ADD] Process 17 added to the queue at time 22.141243934631348, shots: 1000.
[ADD] Process 18 added to the queue at time 23.541012048721313, shots: 1000.
[ADD] Process 19 added to the queue at time 23.64656114578247, shots: 1000.
[ADD] Process 20 added to the queue at time 24.966819524765015, shots: 1000.
[UTILITY] New batch has utility 0.6390977443609023.
[PROCESS COUNT] New batch has 7 processes.
[SHARING RATIO] New batch has helper qubit sharing ratio 0.0.
[ADD] Process 21 added to the queue at time 30.872427701950073, shots: 1000.
[ADD] Process 22 added to the queue at time 33.12895178794861, shots: 1000.
[BATCH] Process batch with [15, 16, 17, 18, 19, 20, 21, 22] selected with min shots 1000.
[HARDWARE RESULT] {3: {'00000000': 322, '11000000': 77, '01000000': 300, '10000000': 76, '01001000': 43, '00000010': 19, '11001000': 15, '01101000': 4, '01000100': 4, '00001000': 47, '00000100': 4, '10001010': 2, '01000010': 11, '00101000': 3, '00010000': 4, '01100000': 8, '01000001': 1, '01001010': 3, '11001100': 1, '11001010': 1, '10001000': 13, '00001100': 6, '00001010': 6, '10100000': 2, '01010000': 1, '11100000': 2, '00100000': 5, '01000110': 2, '11000010': 6, '00000110': 1, '00011000': 1, '01011000': 2, '10000010': 2, '10000100': 2, '01010100': 1, '00011010': 1, '10001100': 1, '00011110': 1}, 6: {'01000000': 410, '01000001': 12, '10000000': 16, '01001000': 34, '01101000': 2, '00000000': 368, '11000001': 2, '00000001': 27, '00001001': 4, '01001001': 7, '11000000': 11, '00101000': 3, '00001000': 52, '01010001': 2, '00010000': 6, '01000010': 2, '01010000': 6, '00000100': 6, '01000100': 5, '00000010': 3, '10000001': 3, '00100000': 7, '10001000': 1, '01100000': 6, '01001100': 1, '00001010': 1, '11101000': 1, '00000101': 1, '00101001': 1}, 7: {'00000000': 347, '00001000': 20, '01000000': 331, '00000010': 21, '01010110': 1, '01001000': 30, '11000000': 19, '01100000': 9, '01001100': 4, '01011000': 3, '01000100': 18, '00001100': 4, '11001000': 6, '11010000': 5, '01010000': 19, '00011000': 6, '11011000': 4, '00010000': 27, '01001010': 3, '10001010': 2, '11001011': 1, '10110000': 1, '01000010': 16, '10001000': 1, '11100001': 1, '10011010': 1, '00001001': 1, '01100100': 1, '01000101': 1, '10000000': 17, '00100000': 11, '00000001': 7, '01010100': 4, '00000100': 16, '11100100': 1, '01011100': 3, '10000001': 2, '11000100': 4, '10011000': 3, '11000001': 1, '00001110': 3, '00100010': 1, '00001010': 4, '00010100': 1, '10001100': 2, '10100000': 1, '01011010': 1, '00010010': 1, '10011001': 1, '01000001': 2, '10000010': 1, '01101000': 1, '01100001': 1, '00111000': 1, '10010100': 1, '11111000': 1, '10010000': 2, '00010001': 1, '10000011': 1, '01010010': 1}, 0: {'00000': 921, '00001': 52, '00010': 5, '10000': 18, '00100': 2, '10001': 2}, 1: {'000000': 848, '100001': 1, '000010': 15, '001000': 22, '100000': 52, '010000': 49, '001010': 2, '000100': 5, '001100': 1, '110000': 2, '100010': 1, '011000': 1, '010100': 1}, 2: {'10010': 39, '00000': 274, '10000': 534, '10001': 67, '00010': 27, '11000': 3, '00001': 30, '10011': 5, '10101': 3, '10100': 6, '00011': 5, '00110': 2, '00100': 3, '10110': 1, '11001': 1}, 4: {'010000000': 595, '010010000': 40, '010100000': 46, '000000000': 151, '001000000': 6, '010001000': 11, '000000010': 8, '010100100': 1, '010100001': 2, '010001001': 4, '011000000': 23, '010000010': 11, '000000100': 10, '000100000': 16, '110000100': 1, '110011001': 1, '000000001': 1, '010000001': 14, '010010010': 3, '010000100': 10, '000010000': 12, '000011000': 1, '011001000': 1, '110000000': 5, '100000000': 2, '010101000': 3, '010000101': 2, '011010000': 2, '000001000': 6, '000000101': 2, '000110000': 1, '010110000': 1, '011000010': 1, '111100000': 1, '010101001': 1, '000010010': 1, '110010000': 1, '000100100': 1, '000101000': 1, '001010010': 1}, 5: {'01000': 2, '10000': 706, '00000': 207, '10001': 32, '00010': 12, '10010': 22, '00001': 7, '10100': 5, '00011': 2, '10011': 2, '11000': 3}}
[PROCESS FINISH] Process 0 finished all shots at time 35.270198583602905.
[PROCESS FIDELITY] Process 0 fidelity: 0.921
[PROCESS WAITING TIME] Process 0 waiting time: 33.56588792800903 seconds
[PROCESS FINISH] Process 1 finished all shots at time 35.270198583602905.
[PROCESS FIDELITY] Process 1 fidelity: 0.848
[PROCESS WAITING TIME] Process 1 waiting time: 31.309993267059326 seconds
[PROCESS FINISH] Process 2 finished all shots at time 35.270198583602905.
[PROCESS FIDELITY] Process 2 fidelity: 0.7749999999999999
[PROCESS WAITING TIME] Process 2 waiting time: 30.88839888572693 seconds
[PROCESS FINISH] Process 3 finished all shots at time 35.27425813674927.
[PROCESS FIDELITY] Process 3 fidelity: 0.622
[PROCESS WAITING TIME] Process 3 waiting time: 29.00880455970764 seconds
[PROCESS FINISH] Process 4 finished all shots at time 35.27425813674927.
[PROCESS FIDELITY] Process 4 fidelity: 0.6509999999999999
[PROCESS WAITING TIME] Process 4 waiting time: 28.856893062591553 seconds
[PROCESS FINISH] Process 5 finished all shots at time 35.27425813674927.
[PROCESS FIDELITY] Process 5 fidelity: 0.9129999999999999
[PROCESS WAITING TIME] Process 5 waiting time: 28.80096197128296 seconds
[PROCESS FINISH] Process 6 finished all shots at time 35.27425813674927.
[PROCESS FIDELITY] Process 6 fidelity: 0.778
[PROCESS WAITING TIME] Process 6 waiting time: 28.38820242881775 seconds
[PROCESS FINISH] Process 7 finished all shots at time 35.27425813674927.
[PROCESS FIDELITY] Process 7 fidelity: 0.6779999999999999
[PROCESS WAITING TIME] Process 7 waiting time: 26.850175857543945 seconds
[ADD] Process 23 added to the queue at time 35.70816493034363, shots: 1000.
[ADD] Process 24 added to the queue at time 35.98844003677368, shots: 1000.
[ADD] Process 25 added to the queue at time 36.714284896850586, shots: 1000.
[ADD] Process 26 added to the queue at time 45.43223190307617, shots: 1000.
[UTILITY] New batch has utility 0.7593984962406015.
[PROCESS COUNT] New batch has 8 processes.
[SHARING RATIO] New batch has helper qubit sharing ratio 0.0.
[HARDWARE RESULT] {8: {'0000000000': 306, '0000000001': 28, '1000000000': 34, '0001000000': 52, '0000001000': 5, '0010000000': 247, '0100000000': 14, '0000110000': 1, '0011000000': 42, '0011000001': 7, '1010000000': 22, '0001000100': 1, '1001000000': 9, '0010000100': 12, '0011001000': 2, '0010000010': 7, '0010100000': 20, '0010010000': 9, '0110000111': 1, '0010000001': 16, '0001000001': 2, '0000100001': 2, '1000000010': 1, '1011000000': 4, '0000100000': 20, '0011010000': 2, '1010000100': 4, '1011000001': 2, '1000000101': 2, '0000010000': 17, '1101000001': 1, '0011100000': 7, '1000100000': 5, '0001100000': 4, '0000000100': 10, '0010000101': 2, '1010100000': 6, '0001010000': 3, '0000000011': 2, '1100000011': 1, '0000000010': 6, '0110000000': 5, '0100100000': 2, '0111110000': 1, '0001001000': 1, '1001000100': 1, '0000000101': 2, '1001000001': 1, '1000000001': 6, '0010100010': 1, '0010010001': 1, '1011100000': 2, '0010110001': 1, '0010010100': 1, '1000010000': 1, '0001110010': 1, '1000000111': 1, '1010000101': 2, '0010100001': 2, '1000000100': 2, '0010001010': 1, '1000000011': 1, '1100000100': 1, '0001001001': 1, '1100000111': 1, '0001110000': 1, '0101010000': 1, '1011000011': 1, '0011100010': 1, '0001000010': 1, '0011000100': 2, '0100000100': 1, '0100000101': 1, '1001100101': 1, '0101000000': 1, '1010000001': 2, '1100000000': 3, '0010100100': 1, '1110000000': 1, '1010010000': 2, '1001100001': 1, '0010110000': 1, '0111000000': 1}, 12: {'0010001000': 22, '0000000000': 484, '0010000000': 373, '1000000000': 13, '0000010000': 5, '0100000000': 11, '0100100000': 1, '0011001000': 1, '0001000000': 16, '0000001000': 23, '0010100000': 1, '1001000000': 1, '0000000100': 2, '0001100000': 1, '1010000000': 6, '0010000100': 2, '0000100000': 3, '0011000000': 12, '0001001000': 1, '0010010000': 4, '0101000000': 1, '1001001000': 1, '0000000010': 1, '1011000000': 3, '0110000000': 10, '0000101001': 1, '1010001000': 1}, 13: {'0001000': 361, '1001000': 470, '1000000': 21, '1011000': 14, '0101000': 15, '1001001': 20, '1101000': 10, '1111000': 1, '0001001': 18, '1010000': 1, '1001010': 4, '0000000': 28, '0011000': 17, '0001010': 1, '0010000': 1, '0011001': 1, '1101001': 1, '1000001': 5, '0000001': 3, '0001100': 2, '1011010': 1, '1100000': 1, '0010010': 1, '0001011': 1, '1001100': 1, '0011010': 1}, 9: {'00010': 26, '00000': 691, '00100': 41, '01000': 27, '00001': 21, '10000': 132, '10010': 14, '10001': 9, '11000': 10, '01010': 2, '11110': 1, '10100': 14, '10101': 2, '11010': 2, '00110': 4, '01100': 1, '00101': 1, '11100': 1, '11001': 1}, 10: {'00000': 878, '00100': 46, '00010': 24, '00001': 2, '10100': 1, '10000': 36, '01000': 7, '10010': 2, '10001': 2, '00101': 1, '00110': 1}, 11: {'010100': 50, '010101': 4, '010110': 7, '000100': 803, '000110': 59, '000000': 15, '000101': 21, '001100': 22, '011100': 4, '100100': 3, '010000': 1, '001110': 2, '000111': 6, '101100': 1, '010111': 1, '001101': 1}, 14: {'000100': 830, '000101': 41, '000110': 7, '100000': 2, '100100': 26, '000000': 71, '010100': 11, '001100': 3, '000001': 5, '011100': 1, '110100': 1, '010000': 1, '000010': 1}}
[PROCESS FINISH] Process 8 finished all shots at time 70.15235042572021.
[PROCESS FIDELITY] Process 8 fidelity: 0.5529999999999999
[PROCESS WAITING TIME] Process 8 waiting time: 61.35425615310669 seconds
[PROCESS FINISH] Process 9 finished all shots at time 70.15235042572021.
[PROCESS FIDELITY] Process 9 fidelity: 0.691
[PROCESS WAITING TIME] Process 9 waiting time: 59.32085061073303 seconds
[PROCESS FINISH] Process 10 finished all shots at time 70.15235042572021.
[PROCESS FIDELITY] Process 10 fidelity: 0.878
[PROCESS WAITING TIME] Process 10 waiting time: 58.71831655502319 seconds
[PROCESS FINISH] Process 11 finished all shots at time 70.15235042572021.
[PROCESS FIDELITY] Process 11 fidelity: 0.8029999999999999
[PROCESS WAITING TIME] Process 11 waiting time: 58.51538848876953 seconds
[PROCESS FINISH] Process 12 finished all shots at time 70.1538622379303.
[PROCESS FIDELITY] Process 12 fidelity: 0.857
[PROCESS WAITING TIME] Process 12 waiting time: 57.82007193565369 seconds
[PROCESS FINISH] Process 13 finished all shots at time 70.1538622379303.
[PROCESS FIDELITY] Process 13 fidelity: 0.831
[PROCESS WAITING TIME] Process 13 waiting time: 57.127679109573364 seconds
[PROCESS FINISH] Process 14 finished all shots at time 70.1538622379303.
[PROCESS FIDELITY] Process 14 fidelity: 0.83
[PROCESS WAITING TIME] Process 14 waiting time: 52.77269172668457 seconds
[BATCH] Process batch with [23, 24, 25, 26] selected with min shots 1000.
[UTILITY] New batch has utility 0.3082706766917293.
[PROCESS COUNT] New batch has 4 processes.
[SHARING RATIO] New batch has helper qubit sharing ratio 0.0.
[HARDWARE RESULT] {16: {'1000000000': 239, '1000000001': 5, '0000010000': 18, '1010000000': 1, '0001100000': 10, '1001000000': 205, '0000000000': 86, '1000100010': 1, '0000010001': 1, '1000110000': 12, '1000010001': 3, '1001100000': 20, '1001010000': 70, '0001000000': 76, '0001010000': 21, '1100000000': 7, '1101000000': 2, '0100010000': 3, '1000010000': 79, '1000100000': 37, '1100100000': 2, '1001000001': 8, '1001000010': 6, '1100000100': 1, '0001100100': 1, '0000110000': 6, '0100000000': 3, '1000000010': 9, '1000010010': 2, '1001110000': 9, '1100010000': 7, '0000110010': 1, '0011000000': 1, '1001000100': 2, '1000000100': 4, '0000100000': 8, '0000000001': 2, '0000010010': 2, '1011000000': 3, '0101010000': 1, '1001001000': 4, '0000000010': 1, '1000100100': 1, '0001000100': 1, '1001010001': 1, '0001110000': 5, '1010100000': 2, '0001010010': 1, '0001000001': 1, '1101010000': 1, '0001010100': 1, '1011010000': 1, '1010010000': 1, '0001000010': 1, '1001011000': 1, '0101000000': 2, '0000000100': 1}, 17: {'0010000000': 118, '0000010000': 243, '0010010000': 252, '0000001000': 1, '0001010000': 20, '0000000000': 155, '1000010000': 8, '1010000000': 2, '0100010100': 1, '0100010000': 33, '0010110000': 9, '0011010000': 28, '0001000000': 17, '0011000000': 9, '0010010100': 8, '0110010000': 30, '0010000100': 4, '0100000000': 11, '0110000000': 8, '0010100000': 6, '0001100000': 1, '0111000000': 1, '0000110000': 4, '0000010100': 10, '0000100000': 3, '0101010000': 3, '0010110100': 1, '1010010000': 1, '0101110100': 1, '0111010000': 2, '0000000100': 3, '1010110000': 1, '0000000010': 1, '0010010001': 1, '0001010100': 1, '0110010100': 1, '0110100000': 1, '1000000000': 1}, 22: {'0000000000': 317, '0000100010': 9, '0000000001': 30, '0010000000': 285, '0000010000': 16, '0010010010': 3, '0010000010': 49, '0000100000': 36, '0010000011': 8, '0000000010': 69, '0010010000': 16, '0010100000': 25, '1010000000': 20, '1000000000': 22, '0010010001': 3, '1010100000': 4, '0110000000': 3, '0000010001': 2, '1000010010': 1, '0100000001': 1, '0000000100': 2, '0010101000': 1, '1000000001': 4, '0000100001': 5, '0100000000': 3, '0000000011': 4, '0010000001': 28, '1010000010': 4, '0000010010': 2, '0010110010': 1, '1000010000': 1, '1000000010': 2, '1000000100': 1, '1010010011': 1, '0010100010': 6, '1001000010': 1, '1010010000': 2, '0001000000': 1, '0010110000': 1, '0010100001': 1, '1010000001': 2, '0000001000': 2, '1000100000': 4, '0010011010': 1, '0010100011': 1}, 15: {'00000000': 522, '00000100': 60, '00010000': 4, '10000000': 10, '00000001': 44, '00001001': 21, '00001000': 265, '00001100': 30, '10001000': 5, '00101001': 2, '00101000': 5, '10000100': 2, '00000010': 1, '00011000': 3, '01000000': 3, '00000101': 3, '01001000': 4, '00001101': 5, '10000001': 1, '00100000': 5, '10001100': 2, '00100001': 2, '00010100': 1}, 18: {'00000': 833, '00001': 24, '01000': 34, '00100': 77, '00101': 3, '00110': 1, '01100': 4, '01001': 8, '00011': 1, '01101': 2, '00010': 5, '10000': 5, '01010': 2, '11000': 1}, 19: {'100000': 53, '000001': 278, '100001': 39, '000000': 528, '000100': 3, '001000': 31, '001001': 24, '000011': 9, '101001': 4, '100011': 1, '100010': 3, '000010': 13, '001011': 3, '001010': 7, '000101': 1, '101000': 3}, 20: {'10000': 606, '00000': 213, '11000': 38, '10010': 9, '10001': 51, '11010': 1, '01000': 12, '01100': 2, '00100': 15, '10100': 14, '00001': 17, '11101': 1, '11001': 7, '00110': 1, '00101': 2, '00010': 5, '11100': 1, '10011': 2, '00011': 1, '10101': 1, '01010': 1}, 21: {'000000': 581, '000100': 179, '000010': 76, '100000': 28, '000110': 20, '010010': 2, '111001': 1, '000001': 23, '001000': 27, '100100': 5, '110000': 2, '010000': 23, '010100': 8, '100010': 6, '001100': 9, '011000': 1, '100111': 1, '100001': 2, '000101': 3, '001010': 1, '010101': 1, '010001': 1}}
[PROCESS FINISH] Process 15 finished all shots at time 92.62858700752258.
[PROCESS FIDELITY] Process 15 fidelity: 0.522
[PROCESS WAITING TIME] Process 15 waiting time: 73.61874127388 seconds
[PROCESS FINISH] Process 16 finished all shots at time 92.62858700752258.
[PROCESS FIDELITY] Process 16 fidelity: 0.6059999999999999
[PROCESS WAITING TIME] Process 16 waiting time: 72.45568561553955 seconds
[PROCESS FINISH] Process 17 finished all shots at time 92.62958073616028.
[PROCESS FIDELITY] Process 17 fidelity: 0.27300000000000013
[PROCESS WAITING TIME] Process 17 waiting time: 70.48833680152893 seconds
[PROCESS FINISH] Process 18 finished all shots at time 92.62958073616028.
[PROCESS FIDELITY] Process 18 fidelity: 0.833
[PROCESS WAITING TIME] Process 18 waiting time: 69.08856868743896 seconds
[PROCESS FINISH] Process 19 finished all shots at time 92.63058304786682.
[PROCESS FIDELITY] Process 19 fidelity: 0.5279999999999999
[PROCESS WAITING TIME] Process 19 waiting time: 68.98402190208435 seconds
[PROCESS FINISH] Process 20 finished all shots at time 92.63058304786682.
[PROCESS FIDELITY] Process 20 fidelity: 0.2130000000000002
[PROCESS WAITING TIME] Process 20 waiting time: 67.6637635231018 seconds
[PROCESS FINISH] Process 21 finished all shots at time 92.63058304786682.
[PROCESS FIDELITY] Process 21 fidelity: 0.581
[PROCESS WAITING TIME] Process 21 waiting time: 61.75815534591675 seconds
[PROCESS FINISH] Process 22 finished all shots at time 92.63158869743347.
[PROCESS FIDELITY] Process 22 fidelity: 0.6019999999999999
[PROCESS WAITING TIME] Process 22 waiting time: 59.50263690948486 seconds
[HARDWARE RESULT] {23: {'00000': 762, '11000': 1, '00001': 29, '10001': 12, '10000': 97, '00010': 31, '01000': 24, '00110': 1, '01010': 2, '10010': 10, '00100': 17, '10100': 3, '00011': 2, '10111': 1, '10110': 2, '01100': 1, '10011': 5}, 24: {'000100': 847, '010000': 1, '000110': 56, '010100': 25, '100110': 2, '100100': 36, '010110': 2, '001100': 15, '110100': 1, '000000': 7, '000101': 5, '101100': 2, '100000': 1}, 25: {'000100': 808, '001100': 55, '100100': 45, '000101': 13, '010100': 30, '000110': 22, '110100': 3, '000111': 4, '101100': 2, '100110': 2, '000000': 5, '011100': 1, '001111': 1, '100101': 1, '001110': 2, '010101': 1, '001101': 1, '111100': 1, '001000': 1, '000011': 1, '010001': 1}, 26: {'00000': 984, '01000': 9, '10000': 3, '00010': 1, '00001': 1, '00100': 2}}
[PROCESS FINISH] Process 23 finished all shots at time 105.4852032661438.
[PROCESS FIDELITY] Process 23 fidelity: 0.762
[PROCESS WAITING TIME] Process 23 waiting time: 69.77703833580017 seconds
[PROCESS FINISH] Process 24 finished all shots at time 105.48619174957275.
[PROCESS FIDELITY] Process 24 fidelity: 0.847
[PROCESS WAITING TIME] Process 24 waiting time: 69.49775171279907 seconds
[PROCESS FINISH] Process 25 finished all shots at time 105.48619174957275.
[PROCESS FIDELITY] Process 25 fidelity: 0.808
[PROCESS WAITING TIME] Process 25 waiting time: 68.77190685272217 seconds
[PROCESS FINISH] Process 26 finished all shots at time 105.48720097541809.
[PROCESS FIDELITY] Process 26 fidelity: 0.984
[PROCESS WAITING TIME] Process 26 waiting time: 60.05496907234192 seconds
[STOP] Scheduling stopped at time 106.49301958084106.
------------------Statistics:---------------------------------Total running time: 105.94389605522156
Finished process count: 27
Throughput: 
0.25485186976630236
----------------------Batch statistics-----------------------:
Batch 0: Number of processes: 8, Qubit utilization: 0.6616541353383458
Batch 1: Number of processes: 7, Qubit utilization: 0.6390977443609023
Batch 2: Number of processes: 8, Qubit utilization: 0.7593984962406015
Batch 3: Number of processes: 4, Qubit utilization: 0.3082706766917293
Batch 0: Shared ratio: 0.0
Batch 1: Shared ratio: 0.0
Batch 2: Shared ratio: 0.0
Batch 3: Shared ratio: 0.0
Average shared ratio per batch: 0.0
Average number of processes per batch: 6.75
Average qubit utility per batch: 0.5921052631578947
----------------------Process waiting times-----------------------:
Process 0: 33.56588792800903
Process 1: 31.309993267059326
Process 2: 30.88839888572693
Process 3: 29.00880455970764
Process 4: 28.856893062591553
Process 5: 28.80096197128296
Process 6: 28.38820242881775
Process 7: 26.850175857543945
Process 8: 61.35425615310669
Process 9: 59.32085061073303
Process 10: 58.71831655502319
Process 11: 58.51538848876953
Process 12: 57.82007193565369
Process 13: 57.127679109573364
Process 14: 52.77269172668457
Process 15: 73.61874127388
Process 16: 72.45568561553955
Process 17: 70.48833680152893
Process 18: 69.08856868743896
Process 19: 68.98402190208435
Process 20: 67.6637635231018
Process 21: 61.75815534591675
Process 22: 59.50263690948486
Process 23: 69.77703833580017
Process 24: 69.49775171279907
Process 25: 68.77190685272217
Process 26: 60.05496907234192
Average waiting time across all processes: 53.88741291010821
----------------------Process fidelities-----------------------:
Process 0: 0.921
Process 1: 0.848
Process 2: 0.7749999999999999
Process 3: 0.622
Process 4: 0.6509999999999999
Process 5: 0.9129999999999999
Process 6: 0.778
Process 7: 0.6779999999999999
Process 8: 0.5529999999999999
Process 9: 0.691
Process 10: 0.878
Process 11: 0.8029999999999999
Process 12: 0.857
Process 13: 0.831
Process 14: 0.83
Process 15: 0.522
Process 16: 0.6059999999999999
Process 17: 0.27300000000000013
Process 18: 0.833
Process 19: 0.5279999999999999
Process 20: 0.2130000000000002
Process 21: 0.581
Process 22: 0.6019999999999999
Process 23: 0.762
Process 24: 0.847
Process 25: 0.808
Process 26: 0.984
Average fidelity across all processes: 0.7106666666666664
